;Index;id;name;city;min_salary;max_salary;company;published_at;experience;schedule;employment;description;conditions;requirement;responsibility;key_skills;days
13;68;34140702;Android-разработчик;Новосибирск;120000.0;100000.0;Apple Concierge;2019-10-17T13:16:57+0300;От 3 до 6 лет;Полный день;Полная занятость;"Компания рынка luxury - услуг в России приглашает кандидатов на должность Android-разработчик. Обязанности:  Разработка продукта Консьерж-сервиса; Поддержка существующего проекта; Работа с проектом международного уровня.  Требования:  Опыт в софтверной разработке от 2-х лет; Знание платформы Android; Свободное владение языком Java; Знание ООП и шаблонов проектирования; task-oriented, умение работать на результат; Способность быстро разбираться в новом; Умение разбираться в чужом коде; Знание английского языка на уровне чтения технической документации; Адекватное восприятие критики.  Условия:  Мы готовы обсуждать заработную плату и график работы с успешным кандидатом; Возможность профессионального развития в команде, которая гордится тем, что делает! ";"  Мы готовы обсуждать заработную плату и график работы с успешным кандидатом; Возможность профессионального развития в команде, которая гордится тем, что делает! ";Опыт в софтверной разработке от 2-х лет. Знание платформы Android. Свободное владение языком Java. Знание ООП и шаблонов проектирования. ;Разработка продукта Консьерж-сервиса. Поддержка существующего проекта. Работа с проектом международного уровня.;"Java; Английский язык; ООП; Android; Java SE";1.0
14;82;32961844;Android разработчик;Екатеринбург;0.0;0.0;СКБ ЛАБ;2019-10-16T07:53:41+0300;От 1 года до 3 лет;Гибкий график;Полная занятость;SKB_Lab - это передовой IT-проект. Он создан для разработки абсолютно нового интернет-банка и мобильных приложений для него, как для физических, так и для юридических лиц. Если говорить про философию работы, то мы применяем agile подходы. Исходя из этого, можно сказать, что мы гибкие - у каждого есть возможность влиять на принятие решений в проектах! Вся команда, вместе с руководством, находится в офисе в Екатеринбурге, что, несомненно, влияет на скорость принятия решений, и отсутствие бюрократии. Обязанности:  Разработка нового функционала приложений. Написание кода, построение и переработка архитектуры приложения.  Мы ждем от вас:  Опыт нативной разработки для Android от 1 года. Уверенное знание Java, Android SDK. Мы используем: Kotlin, Cicerone, Toothpick, RxJava, Moxy, Retrofit и кое-что еще. Инструменты: YouTrack, Slack, UpSource, Zeplin. Умение работать с системой контроля версий, CI. Знание классических алгоритмов и структур данных. Желателен опыт реализации собственных проектов под Android. Знание любой другой из мобильных платформ приветствуется. Стремление повышать собственный уровень профессиональной квалификации. Знание технического английского языка.  Условия:  Заработная плата, которая будет радовать (уровень дохода зависит от ваших навыков и технических знаний). Премии (не только по итогам года). Даем простор в развитии «профессиональной мускулатуры», предлагая работу вместе с профессионалами. Мы можем доверить вам участие в развитии наших продуктов, возможность предлагать идеи и технологии. Предлагаем возможность участия в мероприятиях для профессионального развития. Конференции, тренинги, учебные курсы. Обустроим для вас удобное рабочее место с современной техникой. Компенсируем занятия спортом. Оплатим паркинг, если вы на машине, а если машины нет, то мы оплатим ваш проезд на общественном транспорте (дадим безлимитную Е-карту) и припаркуем ваш велосипед. Мы располагаемся в отличном офисе с великолепным панорамным видом на город. На кофе-поинте вас всегда будут ждать плюшки и свежий кофе. Мы даже подумали о том, как вы будете расслабляться в офисе: у нас есть зоны релакса, массажист, душ, кикер, аэрохоккей, боксёрская груша и гимнастический станок. Мы отладили все наши процессы таким образом, чтобы вас не тревожили вопросы бюрократии.  Мы ценим:   Тех, кто уважает мнение Заказчика. Тех, кто не боится ответственности. Тех, кто работает на результат. Тех, кто не требует микроменеджмента и постоянного менторства. Тех, кто сказал, что все будет готово в пятницу, и финишировал в четверг вечером. Тех, кто готов делиться своим опытом. Красивый код.  Ждем Вас в нашем офисе! Обсудим больше подробностей.;  Заработная плата, которая будет радовать (уровень дохода зависит от ваших навыков и технических знаний). Премии (не только по итогам года). Даем простор в развитии «профессиональной мускулатуры», предлагая работу вместе с профессионалами. Мы можем доверить вам участие в развитии наших продуктов, возможность предлагать идеи и технологии. Предлагаем возможность участия в мероприятиях для профессионального развития. Конференции, тренинги, учебные курсы. Обустроим для вас удобное рабочее место с современной техникой. Компенсируем занятия спортом. Оплатим паркинг, если вы на машине, а если машины нет, то мы оплатим ваш проезд на общественном транспорте (дадим безлимитную Е-карту) и припаркуем ваш велосипед. Мы располагаемся в отличном офисе с великолепным панорамным видом на город. На кофе-поинте вас всегда будут ждать плюшки и свежий кофе. Мы даже подумали о том, как вы будете расслабляться в офисе: у нас есть зоны релакса, массажист, душ, кикер, аэрохоккей, боксёрская груша и гимнастический станок. Мы отладили все наши процессы таким образом, чтобы вас не тревожили вопросы бюрократии.  Мы ценим:   Тех, кто уважает мнение Заказчика. Тех, кто не боится ответственности. Тех, кто работает на результат. Тех, кто не требует микроменеджмента и постоянного менторства. Тех, кто сказал, что все будет готово в пятницу, и финишировал в четверг вечером. Тех, кто готов делиться своим опытом. Красивый код.  Ждем Вас в нашем офисе! Обсудим больше подробностей.;Опыт нативной разработки для Android от 1 года. Уверенное знание Java, Android SDK. Мы используем: Kotlin, Cicerone, Toothpick, RxJava, Moxy...;Разработка нового функционала приложений. Написание кода, построение и переработка архитектуры приложения.;"Agile Project Management; Обучение персонала; Redmine; Android; Android SDK; Java; kotlin";3.0
15;92;32942394;Android разработчик;Новосибирск;85000.0;100000.0;ПКБ;2019-10-18T15:25:28+0300;От 1 года до 3 лет;Полный день;Полная занятость;"Обязанности:  Разработка мобильных приложений  Требования:  Высшее; Опыт работы на аналогичной должности – от 2 лет; Английский язык на уровне чтения документации; Уверенные знания Android SDK, RXJava, Dagger, Retrofit, DataBindings, WebSocket. Желателен опыт работы с Realm, MVI, Kotlin, написание Unit Test  Условия:  Официальное трудоустройство согласно ТК РФ Белая зп ( оклад+ бонус ) Возможность профессионального развития ";  Официальное трудоустройство согласно ТК РФ Белая зп ( оклад+ бонус ) Возможность профессионального развития ;Высшее. Опыт работы на аналогичной должности – от 2 лет. Английский язык на уровне чтения документации. Уверенные знания Android SDK, RXJava...;Разработка мобильных приложений.;"Android SDK; RXJava; Dagger; Retrofit; DataBindings; WebSocket; Разработка мобильных приложений";0.0
16;46;32646654;Android developer;Омск;0.0;0.0;Центр Цифровых Коммуникаций;2019-10-18T11:54:42+0300;От 1 года до 3 лет;Удаленная работа;Полная занятость;"Наша команда активно растет и прямо сейчас в ней есть место для Android Developer, который может, умеет, практикует…  Java/Kotlin под Android с практическим опытом от 2 лет и навыками разработки архитектуры приложений и проектирования,Android SDK, API 21+, Material Design, Design Patterns; понимает принципы ООП и SOLID, параллельного и многопоточного программирования; разбирается в разработке клиент-серверных приложений; имеет опыт работает с Retrofit2, RXjava2, а также git и git flow; на практике использует в приложениях облачные сервисы.  Плюсом будет:  опыт писать unit-тесты; опыт работы с записью/воспроизведением/оптимизацией видео/аудио; желание делать качественный коммерческий продукт; внимание к деталям; готовность работать на результат и ответственность; знание технического английского.  Работа в нашей команде - это:  уникальный опыт создания, запуска и развития продукта на зарубежных рынках; увлекательные задачи, возможность использовать самые современные технологии разработки и исследований; честная зарплата и социальный пакет (отпускные, больничные, все необходимые налоговые отчисления, программа ДМС); широки возможности профессионального развития и обучения. ";;Java/Kotlin под Android с практическим опытом от 2 лет и навыками разработки архитектуры приложений и проектирования,Android SDK, API...;;" Android; Android SDK; Java; Kotlin; Git";0.0
17;90;32218679;Senior Android разработчик;Омск;0.0;0.0;Ronas IT;2019-10-12T18:38:44+0300;Более 6 лет;Гибкий график;Полная занятость;"Обязанности:  разработка мобильных приложений под платформу Android.  Требования:  опыт разработки на Java или Kotlin; опыт работы с Android SDK; опыт работы с системами сборки проектов (Grade/Maven); знание гайдлайнов; опыт работы с SQL (SQLite); работа с форматами передачи данных XML, JSON; лидерские качества; ​желание развиваться.  Приветствуется:  опыт работы в команде; опыт работы с системами контроля версий; опыт проектной работы; умение адекватно оценивать задачи и сроки их выполнения; опыт разработки под iOS.  Условия:  интересные проекты для различных иностранных компаний; просторный офис в самом центре города, открытый 24/7; свободный рабочий график; полный социальный пакет; обучение английскому языку за счет компании; программа компенсации затрат на обеды; программа компенсации медицинских расходов; конкурентная заработная плата.   ";"  интересные проекты для различных иностранных компаний; просторный офис в самом центре города, открытый 24/7; свободный рабочий график; полный социальный пакет; обучение английскому языку за счет компании; программа компенсации затрат на обеды; программа компенсации медицинских расходов; конкурентная заработная плата.   ";Опыт разработки на Java или Kotlin. Опыт работы с Android SDK. Опыт работы с системами сборки проектов (Grade/Maven). ;Разработка мобильных приложений под платформу Android.;" Android; Android SDK; Java; Kotlin; Git";6.0
18;44;32942395;Android разработчик;Ростов-на-Дону;42500.0;92500.0;ПКБ;2019-10-18T15:25:26+0300;От 1 года до 3 лет;Полный день;Полная занятость;"Обязанности:  Разработка мобильных приложений  Требования:  Высшее; Опыт работы на аналогичной должности – от 2 лет; Английский язык на уровне чтения документации; Уверенные знания Android SDK, RXJava, Dagger, Retrofit, DataBindings, WebSocket. Желателен опыт работы с Realm, MVI, Kotlin, написание Unit Test  Условия:  Официальное трудоустройство согласно ТК РФ Белая зп ( оклад+ бонус ) Возможность профессионального развития ";  Официальное трудоустройство согласно ТК РФ Белая зп ( оклад+ бонус ) Возможность профессионального развития ;Высшее. Опыт работы на аналогичной должности – от 2 лет. Английский язык на уровне чтения документации. Уверенные знания Android SDK, RXJava...;Разработка мобильных приложений.;"Android SDK; RXJava; Dagger; Retrofit; DataBindings; WebSocket; Разработка мобильных приложений";0.0
19;94;34102778;Android-разработчик (Middle / Senior);Ростов-на-Дону;42500.0;92500.0;Бастион;2019-10-18T13:54:54+0300;От 1 года до 3 лет;Полный день;Полная занятость;"В рамках компании Бастион стремительно развивается направление разработки программного обеспечения для приборов собственного производства : оборудование для систем безопасности как частных домовладений, так и крупных объектов, оборудование для систем отопления, аквариумов и др. Обязанности:  Проектирование и разработка мобильных приложений для выпускаемых компанией приборов в соответствии с техническим заданием Декомпозиция и оценка задач по разработке Оформление и документирование результатов разработки в соответствии с внутренними стандартами компании.  Требования:  Знание принципов ООП Опыт разработки Android-приложений, наличие своих приложений в Play Market, готовность их продемонстрировать. Знание технического английского в объёме достаточном, для изучения технической документации. Умение проектировать приложения с разделением кода на слои. Умение структурировать и документировать код и архитектуру приложений; Опыт проектирования пользовательского интерфейса. Навыки управления командой разработчиков - желательно Опыт работы в кросс-платформенных разработках будет плюсом  Условия:  Работа в офисе. График: пн-пт с 9 до 18 часов Стабильная заработная плата. Уровень заработной платы обсуждается на собеседовании и зависит от навыков и умений кандидата. Оформление согласно ТК РФ Возможность обучения и повышения своей квалификации за счет Компании ";  Работа в офисе. График: пн-пт с 9 до 18 часов Стабильная заработная плата. Уровень заработной платы обсуждается на собеседовании и зависит от навыков и умений кандидата. Оформление согласно ТК РФ Возможность обучения и повышения своей квалификации за счет Компании ;Умение структурировать и документировать код и архитектуру приложений. Опыт проектирования пользовательского интерфейса. Навыки управления командой <highlighttext>разработчиков</highlighttext> - желательно. Опыт работы в...;Проектирование и разработка мобильных приложений для выпускаемых компанией приборов в соответствии с техническим заданием. Декомпозиция и оценка задач по разработке. ;"Android; Проектирование пользовательских интерфейсов; ООП";0.0
