;Index;id;name;city;min_salary;max_salary;company;published_at;experience;schedule;employment;description;conditions;requirement;responsibility;key_skills;days
7;73;33421561;Android разработчик;Новосибирск;50000.0;100000.0;FullStack;2019-10-17T23:58:54+0300;От 1 года до 3 лет;Полный день;Полная занятость;"Требуется Android разработчик для работы в команде над мульти-платформенным продуктом (Android, iOS) в сфере горнолыжного спорта. Продукт свой, никакого аутсорса, поэтому самые высокие требования к качеству кода и приложения в целом. Что из себя представляет продукт и остальные детали расскажем на собеседовании.   Основные требования:  Умение писать качественный ООП код; Знание Kotlin либо возможность быстро его освоить; Способность делать оценки и укладываться в них; Android Studio; RxJava; REST.    Не технические требования:  Английский на уровне чтения/понимания без словаря.    Обязанности и задачи:  Разработка; Поддержание стиля и архитектуры кода; Code review.    Условия работы:  40 часовая рабочая неделя в офисе в Новосибирске (гибкий график). Оформление в соответствии с ТК РФ; Оплачиваемые занятия спортом; Оплачиваемое питание; Гибкий график работы. ";;Умение писать качественный ООП код. Знание Kotlin либо возможность быстро его освоить. Способность делать оценки и укладываться в них. ;Разработка. Поддержание стиля и архитектуры кода. Code review.;" Android; Android SDK; Java; Kotlin; Git";1.0
8;74;33911726;Инженер-программист (Андроид);Санкт-Петербург;60000.0;100000.0;InTheSmart;2019-10-18T17:50:33+0300;От 3 до 6 лет;Полный день;Полная занятость;"Обязанности:  Участие в разработке и развитии наших продуктов для Android; Оптимизация и модификация программных решений для повышение качества работы приложений; Развитие и оптимизация уже разработанных алгоритмов; Выполнять рефакторинг существующего кода; Участвовать в процессе код-ревью.    Требования:  Высшее профессиональное (техническое) образование; Опыт работы в данной области от 3 лет; Навыки разработки программного обеспечения на С/C++, Phyton, Lua, знание алгоритмов и структур данных; Уверенное знание Java и Android SDK; Знание SQL и опыт работы с SQLite; Опыт работы с алгоритмами распознавания и цифровой обработки изображений, системами машинного обучения; Опыт реализации сложных и быстрых UI компонентов; Практические навыки использования Git / SVN; Умение читать (понимать) техническую документацию на английском языке; Ответственность, инициативность, системное мышление, нацеленность на результат, умение работать в коллективе, готовность к изучению новых технологий.    Будет преимуществом:  Знание различных платформ, в частности Linux / Qt, Android (Java); Опыт разработки и применения алгоритмов обработки изображений и компьютерного зрения для коммерческих систем; Опыт реализации проектов ЦОС для ПЛИС; Опыт работы с GPU: OpenCL, CUDA, OpenGL; Хорошая математическая подготовка.    Условия:  Работа в филиале Южнокорейской компании - разработчика медицинской техники; Интересные, перспективные проекты; График работы: 5 / 2; Оформление по ТК РФ; Дружный молодой коллектив; Работа в современном офисе в пешеходной доступности от ст. м. Василеостровская; Полностью официальная заработная плата - обсуждается с кандидатами по результатам собеседования.  Дополнительно:  Возможность поездок в Южную Корею для обмена опытом (при желании сотрудника и согласии руководства головного офиса). ";"  Работа в филиале Южнокорейской компании - разработчика медицинской техники; Интересные, перспективные проекты; График работы: 5 / 2; Оформление по ТК РФ; Дружный молодой коллектив; Работа в современном офисе в пешеходной доступности от ст. м. Василеостровская; Полностью официальная заработная плата - обсуждается с кандидатами по результатам собеседования.  Дополнительно:  Возможность поездок в Южную Корею для обмена опытом (при желании сотрудника и согласии руководства головного офиса). ";Высшее профессиональное (техническое) образование. Опыт работы в данной области от 3 лет. Навыки разработки программного обеспечения на С/C++, Phyton...;Участие в разработке и развитии наших продуктов для Android. Оптимизация и модификация программных решений для повышение качества работы приложений. ;"IAR; Linux; C/C++; RTOS; SVN; Git; Управление проектами; Английский язык; Phyton; Lua; Android; Android SDK";0.0
9;87;34147421;Android developer / Андроид разработчик;Самара;50000.0;70000.0;NEW TECHNOLOGIES LP;2019-10-17T16:47:07+0300;От 1 года до 3 лет;Полный день;Полная занятость;ИТ-компания New Technologies обустраивает штаб квартиру в Самаре. Мы разрабатываем сервис знакомств, в котором пользователю будет удобно и приятно искать новых друзей или свою половинку. Мы ищем Android разработчика, способного брать на себя ответственность, принимать взвешенные решения, активно участвовать в проекте. Обязанности:  Разработка мобильных приложений под Android на языке Java Написание технической документации Участие в обсуждениях по архитектуре и usability  Требования:  Опыт разработки мобильных приложений под Android Знание принципов ООП и шаблонов проектирования Знание английского языка Умение внятно выражать свои мысли устно и письменно. Умение адекватно оценивать сроки на реализацию той или иной задачи. Умения принимать самостоятельные решения. Умение разбираться в чужом коде, наличие навыков документирования кода и рефакторинга.  Условия:  Справедливая зарплата без задержек (два раза в месяц) по результатам собеседования и вашей квалификации. Работа в комфортном офисе с современной техникой и отличным видом на город в минуте ходьбы от транспортной развязки «Поляна им. Фрунзе». Оформление по договору гражданско-правового характера  Преимуществом будет:  Знание Kotlin. Смежные профессиональные навыки. Релевантный опыт работы в ИТ-компаниях. Высокая коммуникативность. ;  Справедливая зарплата без задержек (два раза в месяц) по результатам собеседования и вашей квалификации. Работа в комфортном офисе с современной техникой и отличным видом на город в минуте ходьбы от транспортной развязки «Поляна им. Фрунзе». Оформление по договору гражданско-правового характера  Преимуществом будет:  Знание Kotlin. Смежные профессиональные навыки. Релевантный опыт работы в ИТ-компаниях. Высокая коммуникативность. ;Опыт разработки мобильных приложений под Android. Знание принципов ООП и шаблонов проектирования. Знание английского языка. Умение внятно выражать свои мысли...;Разработка мобильных приложений под Android на языке Java. Написание технической документации. Участие в обсуждениях по архитектуре и usability.;"Java; Android; ООП; Android SDK; Английский язык; Design Patterns";1.0
10;21;33571697;Начинающий android разработчик;Челябинск;25000.0;40000.0;СофтПлюс;2019-10-17T00:02:13+0300;Нет опыта;Полный день;Полная занятость;"Требования– Крепкие знания основ Java и Android;– Опыт работы с с Activity и Service;– Работа в офисе в Челябинске: удалёнки на постоянной основе нет, иногда можно поработать из дома. С нами вы освоите– Retrofit;– GSON;– Picasso;– Stetho;– Mockito;– JUnit;– Espresso;– Farebase;– Swift, по желанию;– применять на практике принципы SOLID и MVP. Учиться предстоит, в основном, самостоятельно, при поддержке опытной команды и с возможностью получать консультации у лучших экспертов Челябинска. Задачи службыРазработка мобильных приложений для проектов zaycev.net, zaycev.fm, mp3.ru, mursic.ru на платформах Android и iOS, включая AndroidTV, Wear OS. В будущем - AppleTV, Android Auto, CarPlay. Условия– Офис открыт с 08.00 до 22.00, выберите своё время работы самостоятельно.– С вас - качество работ, с нас - информация и оборудование по запросу.– Оплачиваем образование: курсы и профильные конференции.– Работаем без жестких дедлайнов и KPI.– Есть возможность договориться о зарплате выше чем у обычного Junior, учитывая ваш опыт.";;Крепкие знания основ Java и Android. – Опыт работы с с Activity и Service. – JUnit. – Swift, по желанию. – применять на практике...;С вас - качество работ, с нас - информация и оборудование по запросу.;"Java; Android";2.0
11;42;33958110;Начинающий программист Android;Ростов-на-Дону;25000.0;35000.0;ЗАЗЕКС;2019-10-16T15:05:01+0300;Нет опыта;Полный день;Полная занятость;"Наша компания занимается предоставлением полного спектра услуг по разработке ПО для заказчиков со всего мира.Компания состоит из двух офисов – девелоперский центр в Ростове-на-Дону (он же головной офис) и офис продаж в Мельбурне, Австралия.Мы предоставляем услуги web-разработки, мобильной разработки, десктопной разработки, математического прикладного программирования, проектирования, тестирования и создания графического дизайна. Мы приглашаем на работу начинающего программиста Android в отдел мобильной и десктопной разработки в головной офис в Ростове-на-Дону. Требования:  Ответственность; Техническое образование (допускается неоконченное); Обучаемость; Опыт разработки ПО под мобильные платформы; Знание Java; Понимание ООП; Опыт работы с Android SDK; Опыт работы c HTTP, REST API и соответствующими библиотеками (OkHttp, Retrofit, etc).  Будет не лишним:  Опыт командной разработки; Умение работать с Git на базовом уровне; Умение разбираться в чужом коде.  Большим плюсом будет:  Базовое знание C/C++ и опыт сборки линуксовых C/C++ библиотек под NDK;  Опыт использования Google Play Services;  Знание принципов реактивного программирования и опыт применения соответствующих библиотек (RxJava, RxAndroid).  Условия:  Оформление согласно Трудовому Кодексу РФ; Только крупные и сложные проекты; Работа с инновационными технологиями, о которых другие компании боятся даже подумать; Большое количество коллег по цеху, скучать не будете; Система премирования (помимо указанного оклада выплачиваются ежемесячные премии согласно эффективности труда); Оплачиваемые переработки для трудоголиков (9-й и 10-й час в день по тарифу 150%‚ 11-й и далее по тарифу 200%); Возможность корпоративного обучения; Полный соц. пакет; Достойная заработная плата; Уважительное отношение к сотрудникам; Подвозка к месту работы/домой для жителей ЗЖМ; Свой повар + своя столовая; Большой, хороший‚ уютный офис в натуральном деревянном стиле с большим количеством зелени; Неограниченная парковка для сотрудников компании; Бесплатные снэки (перекусы); Доступный досуг (настольный футбол‚ PlayStation VR‚ Sega Mega Drive 2, турник‚ брусья‚ электрогитара‚ басуха‚ пианино, массажное кресло Yamaguchi YA-6000, свежий воздух); Офис вблизи транспортной развязки Квадро; Восьмичасовой рабочий день. Перерыв 1 час + два кофе-тайма по 15 минут; Если вы дочитали до этой строчки, то вот вам бонус: фактическая зарплата, как правило, выше, чем указанная в вакансии; Все вышеперечисленное - правда. ";"  Оформление согласно Трудовому Кодексу РФ; Только крупные и сложные проекты; Работа с инновационными технологиями, о которых другие компании боятся даже подумать; Большое количество коллег по цеху, скучать не будете; Система премирования (помимо указанного оклада выплачиваются ежемесячные премии согласно эффективности труда); Оплачиваемые переработки для трудоголиков (9-й и 10-й час в день по тарифу 150%‚ 11-й и далее по тарифу 200%); Возможность корпоративного обучения; Полный соц. пакет; Достойная заработная плата; Уважительное отношение к сотрудникам; Подвозка к месту работы/домой для жителей ЗЖМ; Свой повар + своя столовая; Большой, хороший‚ уютный офис в натуральном деревянном стиле с большим количеством зелени; Неограниченная парковка для сотрудников компании; Бесплатные снэки (перекусы); Доступный досуг (настольный футбол‚ PlayStation VR‚ Sega Mega Drive 2, турник‚ брусья‚ электрогитара‚ басуха‚ пианино, массажное кресло Yamaguchi YA-6000, свежий воздух); Офис вблизи транспортной развязки Квадро; Восьмичасовой рабочий день. Перерыв 1 час + два кофе-тайма по 15 минут; Если вы дочитали до этой строчки, то вот вам бонус: фактическая зарплата, как правило, выше, чем указанная в вакансии; Все вышеперечисленное - правда. ";Ответственность. Техническое образование (допускается неоконченное). Обучаемость. Опыт разработки ПО под мобильные платформы. Знание Java. Понимание ООП. Опыт работы с Android...;Мы предоставляем услуги web-разработки, мобильной разработки, десктопной разработки, математического прикладного программирования, проектирования, тестирования и создания графического дизайна. ;"Android SDK; Java; C++; Android; Git; ООП";2.0
12;46;33914801;Android - Разработчик;Казань;80000.0;0.0;Mircod;2019-10-16T07:31:03+0300;От 1 года до 3 лет;Полный день;Полная занятость;Компания Mircod занимается разработкой комплексных IoT решений для различных сфер деятельности, включающих в себя электронные гаджеты, мобильные и WEB приложения, а также облачные сервисы. Приглашаем присоединиться к нашей амбициозной команде опытного и такого же амбициозного разработчика. Обязанности:  Разработка и поддержка мобильных приложений, которые работают с устройствами по интерфейсу Bluetooth/WiFi, отображают данные на экране и синхронизируют их с облаком  Требования:  Отличное знание Java Понимание принципов ООП, Clean Architecture RxJava REST API Опыт разработки клиент серверных приложений (Retrofit, OkHttp) Умение работать с ORM решениями для хранения данных Уверенная работа с системой контроля версий Git  Приветствуется:  Знание Kotlin Опыт использования Bluetooth LE в проектах Опыт работы с Firebase Знание C/C++, JNI  Условия:  Работа над интересными проектами Уютный офис в центре Казани Дружный и высококвалифицированный коллектив Перспективы карьерного роста и профессионального развития в молодой компании Тренажерный зал в здании офиса для сотрудников Бесплатные занятия английским Обилие различных вкусностей для поддержания тонуса ;  Работа над интересными проектами Уютный офис в центре Казани Дружный и высококвалифицированный коллектив Перспективы карьерного роста и профессионального развития в молодой компании Тренажерный зал в здании офиса для сотрудников Бесплатные занятия английским Обилие различных вкусностей для поддержания тонуса ;Отличное знание Java. Понимание принципов ООП, Clean Architecture. RxJava. REST API. Опыт разработки клиент серверных приложений (Retrofit, OkHttp). ;Разработка и поддержка мобильных приложений, которые работают с устройствами по интерфейсу Bluetooth/WiFi, отображают данные на экране и синхронизируют их...;"RxJava; C/C++; Retrofit; OkHttp; ORM; Kotlin; Android; Intellij IDEA";3.0
