;Index;id;name;city;min_salary;max_salary;company;published_at;experience;schedule;employment;description;conditions;requirement;responsibility;key_skills;days
11;74;31289679;Java - разработчик;Самара;130000.0;0.0;Сбербанк;2019-10-18T15:27:05+0300;От 3 до 6 лет;Полный день;Полная занятость;"ПАО «Сбербанк» расширяет команду, которая работает над проектами развития IT блока Финансы. Команда является распределенной: Самара, Москва, Санкт – Петербург.  На Самарской площадке в нашу команду войдут разработчики уровня: senior и middle.  Мы создаем автоматизированные инструменты: для комплексной оценки влияния ключевых решений по управлению балансом Банка, для расчета различных финансовых показателей по управлению ликвидностью Банка, для создания информационных витрин для различных систем Банка. Наш Заказчик – Казначейство Сбербанка, является двигателем цифровой трансформации Банка, а также активно делится экспертизой и технологиями с участниками рынка, тем самым повышает качество управления активами и пассивами не только в Банке, но и в банковской системе страны.   Несколько причин работать именно в нашей команде:  В нашей команде реализуются возможности профессионального и карьерного развития, постоянное изучение чего-то нового, отсутствие рутины и однообразия. Наша команда тесно общается с Заказчиком, и выстраивает свои производственные процессы с применением методологии Agile. Наша команда реализует интересные, сложные и перспективные задачи. Вы окажетесь в центре принятия решений и поймете - как работает Банк! У нашей команды - адекватное и лояльное руководство, проводятся частые регулярные встречи 1-на-1 с руководителем для обмена информацией.  Задачи:  Разработка бэкенд-части высоконагруженной банковской расчетной системы на Java; Разработка интеграционных сервисов и микросервисных компонентов на Java (стандарты JMS, REST API); Разработка гибких расчетных компонентов на Groovy/Kotlin; Написание Unit-тестов; Рефакторинг и оптимизация кода, Code review; Участие в тестировании разработанных компонентов и исправлении дефектов; Участие в подготовке документации; Участие в принятии архитектурных решений и исследовательские задачи;  Мы ожидаем:  Понимание принципов ООП; Опыт коммерческой разработки на Java от 2-х лет;   Уверенное знание Java SE (желательно Java SE 8), Collection, JDBC, Multithreading; Знания и опыт использования: Spring Framework (Spring MVC, Spring Security, Spring JDBC); Опыт написания Unit-тестов (Junit, TestNG); Уверенное знание SQL; Опыт работы с Git, Maven; Чтение технической документации на английском; Умение разбираться в чужом коде; Высшее техническое образование;  Было бы дополнительным плюсом:  Знание основных паттернов проектирования; Знакомство и/или опыт использования Java-фреймворков и библиотек (например, ORM) Опыт работы с Jira, Confluence; Опыт работы в Agile-команде; Опыт работы в высоконагруженных проектах, опыт работы с многопоточностью; Умение подбирать инструменты для решения необходимых задач; Понимание или опыт работы в любых других областях программирования (например, любой опыт фронтенд-разработки);  Мы ценим своих сотрудников и предлагаем:  Работа в IT-департаменте крупнейшего банка России; Стабильный и высокий уровень оплаты труда; Оформление по ТК РФ; Социальный пакет + оплата ДМС, тренажерный зал, ежегодное обучение; Широкий спектр дисконт–программ, скидок и привилегий от компаний-партнеров; Льготное кредитование в Сбербанке – возможность пользоваться премиальными продуктами Банка на специальных условиях; Возможность смещения начала рабочего дня ";;Понимание принципов ООП. Опыт коммерческой разработки на Java от 2-х лет. Уверенное знание Java SE (желательно Java SE 8...;Разработка бэкенд-части высоконагруженной банковской расчетной системы на Java. Разработка интеграционных сервисов и микросервисных компонентов на Java (стандарты JMS, REST...;"Java; Spring Framework; SQL";0.0
12;60;22949683;Java/Groovy разработчик;Екатеринбург;50000.0;150000.0;СКБ ЛАБ;2019-10-18T15:59:59+0300;От 1 года до 3 лет;Гибкий график;Полная занятость;  Чего мы ждем от Вас:  Опыт разработки на Java или Groovy от 1 года. Иметь представление о Grails, JMS, Hibernate, PostgreSQL. Умение работать с системой контроля версий, CI. Знание классических алгоритмов и структур данных. Знание Python/Angular2+/HTML будет плюсом. Стремление повышать собственный уровень профессиональной квалификации. Знание технического английского языка.  От нас условия:  Заработная плата, которая будет радовать (уровень дохода зависит от Ваших навыков и технических знаний). Премии (не только по итогам года). Даем простор в развитии профессиональной мускулатуры, работая вместе с профессионалами. Мы можем доверить Вам участие в развитии наших продуктов, предлагать идеи и технологии. Предлагаем возможность участия в мероприятиях для профессионального развития. Конференции, тренинги, учебные курсы. Обустроим для Вас удобное рабочее место с современной техникой. Компенсируем занятия спортом. Оплатим паркинг, если Вы на машине, а если машины нет, то мы оплатим Ваш проезд на общественном транспорте (дадим безлимитную Е-карту) и припаркуем Ваш велосипед. Мы располагаемся в отличном офисе с великолепным панорамным видом на город. На кофе-поинте Вас всегда будут ждать плюшки и свежий кофе. Мы даже подумали о том, как Вы будете расслабляться в офисе. У нас есть зоны релакса, массажист, душ, кикер, аэрохоккей, боксёрская груша и гимнастический станок. Мы отладили все наши процессы таким образом, чтобы Вас не тревожили вопросы бюрократии.  Мы ценим:  Тех, кто не боится ответственности. Тех, кто работает на результат. Тех, кто не требует микроменеджмента и постоянного менторства. Тех, кто сказал, что все будет готово в пятницу, и финишировал в четверг вечером. Тех, кто готов делиться своим опытом. Красивый код. Чувство юмора :)  Мы живем по agile!  Скрам, канбан... знакомо? Если не знакомо - не страшно, расскажем!  Ждем Вас в нашем офисе! Обсудим больше подробностей. З.Ы.: При любых вопросах - не стесняйтесь звонить или писать.;;Опыт разработки на Java или Groovy от 1 года. Иметь представление о Grails, JMS, Hibernate, PostgreSQL. Умение работать с системой...;;"Java; Spring Framework; Hibernate ORM; Java; Git";0.0
13;84;30294725;JAVA / Spring разработчик;Екатеринбург;50000.0;150000.0;СКБ ЛАБ;2019-10-16T07:53:42+0300;От 1 года до 3 лет;Гибкий график;Полная занятость;"Мы - СКБ ЛАБ. У нас в работе есть МНОГО интересных проектов, требующих незамедлительного участия.Мы набираем команду разработчиков, с желанием развиваться, которые смогут не просто реализовать идеи, но и сделать это красиво. У нас работают талантливые разработчики, архитекторы, проектировщики, тестировщики, использующие новые технологии в реальных проектах, которые мы создаем с нуля.Ниже описаны возможные варианты применения Ваших профессиональных интересов. Что делать:  Разработка нового и доработка текущего функционала ДБО.  Мы ждем от вас:  Опыт разработки на Java, Spring от 1 года. Иметь представление JMS, Hibernate, PostgreSQL. Умение работать с системой контроля версий, CI. Знание классических алгоритмов и структур данных Стремление повышать собственный уровень профессиональной квалификации. Знание технического английского языка.  Что предлагаем:  Уровень дохода зависит от ваших навыков и технических знаний; Премии. Не только по итогам года; Возможность развить профессиональную мускулатуру, работая вместе с профессионалами. Познакомиться с лучшими практиками. Возможность участвовать в развитии, предлагать идеи и технологии; Участвовать в мероприятиях для профессионального развития. Тренинги, учебные курсы; Удобное рабочее место с современной техникой; Компенсация занятий спортом; Оплата паркинга для автолюбителей, и Е-карта для пешеходов; Отличный офис с великолепным панорамным видом на город, кухней (фрукты, булки, чай, кофе прилагаются - как без глюкозы? ;)) и зонами релакса; Велопарковка, душ, кикер, теннисный стол, боксёрская груша :) и гимнастический станок; Отлаженные процессы. Минимум бюрократии; Лояльный график рабочего дня.  Мы ценим:   Тех, кто уважает мнение Заказчика Тех, кто не боится ответственности Тех, кто работает на результат. Тех, кто не требует микроменеджмента и постоянного менторства Тех, кто сказал, что все будет готово в пятницу, и финишировал в четверг вечером Тех, кто готов делиться своим опытом Красивый код Чувство юмора  Мы живем:  По agile (скрам, канбан - знакомо? Отлично! Нет- не страшно!  Приходите. Ждем Вас в нашем офисе! Обсудим больше подробностей.   З/Ы: При любых вопросах - не стесняйтесь писать.";;Опыт разработки на Java, Spring от 1 года. Иметь представление JMS, Hibernate, PostgreSQL. Умение работать с системой контроля версий, CI. ;Разработка нового и доработка текущего функционала ДБО.;"PostgreSQL; Опыт с Continuous Delivery; Умение писать Unit/Integration Test; Unit Testing; Integration Test; JVM profiling; Databases; database profiling; Java; Spring Framework";3.0
14;95;34083911;Android разработчик (Java);Новосибирск;0.0;0.0;Сибекст;2019-10-18T07:21:30+0300;От 1 года до 3 лет;Полный день;Полная занятость;"Привет! Меня зовут Катя и я - HR manager компании Sibext. В нашей компании есть отдел Android разработки. Работы очень много и нам нужны люди! Но особенность нашей компании заключается в том, что мы ищем не сотрудников, нам нужны единомышленники. Мы вместе решаем за круглым столом как сделать наш продукт лучше, как решить сложные задачи, какое направление нам выбрать и какие технологии будут внедрены сегодня. Давай я расскажу немного о нас и вакансии Android developer. Мы ИТ компания, на рынке с 2013 года, находимся в Технопарке! Мы ориентированный на зарубежный рынок, работаем с заказчиками из Австралии и Европы. Сейчас работаем над одним крупным проектом «Умный дом». Основная задача – разработка ПО для управления системами жизнеобеспечения дома через мобильные устройства. Наш стек технологий для Android developer: - Java, Android SDK, Kotlin Плюсом будет опыт работы с С/С++ - Android NDK, REST API, SQLite , желателен опыт в реактивном программировании ReactiveX. Так как наши заказчики не знают русский зык, то мы переписываемся на английском. Если твой английских хромает, не беда! У нас есть корпоративный английский по понедельникам и пятницам в рабочее время! Внешнее обучение тоже есть, про это можем поговорить на собеседовании. Мотивацию пересматриваем каждые 6 месяцев. Что мы предлагаем: - удовольствие от работы над интересным проектом в компании увлеченных профессионалов; - официальное трудоустройство, соц. пакет, стабильная з/п; - дополнительное обучение по специализации (сертификация); - корпоративное обучение английскому языку; - гибкий график; - великолепный кофе и печеньки в наших уютных офисах в Академгородке (Инженерная) и Новосибирске (Инская)";;Java, Android SDK, Kotlin. Плюсом будет опыт работы с С/С++. - Android NDK, REST API, SQLite , желателен опыт в реактивном...;;"Android SDK; Java; kotlin; C/C++; SQLite";1.0
15;60;34134831;Java-разработчик;Омск;0.0;0.0;Raiffeisenbank;2019-10-17T10:38:30+0300;От 3 до 6 лет;Полный день;Полная занятость;"Мы - крупная международная компания, присутствующая в 15 странах и 40+ городах. Но, что еще важнее, мы позиционируем себя как IT компания с огромной командой сильных технических специалистов, которые претворяют самые смелые идеи в области финансовых технологий в жизнь.Набираем в команду, занимающуюся развитием продукта - сервиса банковских платежей (платежи в рублях, платежи в валюте, система быстрых платежей). Система нагруженная, со сложной бизнес-логикой проведения платежей и отчетной подсистемой. В данный момент перед нами стоит задача разработки новой системы на новом технологическом стекe, поэтому нам просто необходимы сильные разработчики.Нам нужен сильный java-разработчик, способный оценивать и прорабатывать различные архитектурные опции.Необходимая экспертиза и качества  Опыт промышленной разработки на Java стеке от 3 лет; Опыт создания UI (Angular, React.js, Bootstrap и тд); Опыт использования IoC/DI фреймворков (Spring, Guice); Опыт построения архитектуры приложения с использованием SOAP и REST; Опыт использования ORM фреймворков (Hibernate, JPA); Опыт использования Linux; Умение писать сложные SQL выражения; Умение проектировать и реализовывать распределенные высоконагруженные системы; Знание шаблонов проектирования и интеграционных шаблонов построения распределенных систем; Умение аргументированно доказывать свою точку зрения; Поддержка культуры DevOps;  Плюсом будет  Опыт работы с контейнерами и оркестраторами (Docker, Kubernetes/PKS/OpenShift); Опыт работы в командах, работающих по методологиям Agile, Scrum или Kanban; Дополнительное образование/курсы/опыт в не-IT направлениях: маркетинг, продажи, стартапы, управления проектами; Желание принимать активное участие во внешних и внутренних IT конференциях; Знание английского языка (письменная и устная коммуникация).  Мы предлагаем  Наша методология разработки позволяет специалистам очень быстро расти и развиваться в интересных для них направлениях; У нас есть активные направления RD и BigData, в которых можно будет поучаствовать; Мы устраиваем встречи, где делимся знаниями и интересными новостями и новыми технологиями в мире IT (и очень рады желанию коллег выступить с интересной темой); Для своих сотрудников мы проводим разнообразные тренинги; Участвуем в IT конференциях; Работая в нашей компании сотрудники совершенствуют не только техническую экспертизу, но также могут почерпнуть знания в области финансов, банкинга и инвестиций; Также для наших сотрудников мы предлагаем специальные условия по продуктам нашей компании; Отличный социальный пакет, включая ДМС, страхование выезжающих за рубеж Полную отплату больничного (14 календарных дней в год) Обширную программу скидок в компаниях партнерах (фитнес, рестораны, мобильная связь и т.д.) ";;Опыт промышленной разработки на Java стеке от 3 лет. Опыт создания UI (Angular, React.js, Bootstrap и тд). Опыт использования IoC...;Необходимая экспертиза и качества. Поддержка культуры DevOps.;"Spring Framework; Hibernate ORM; Java";1.0
