;Index;id;name;city;min_salary;max_salary;company;published_at;experience;schedule;employment;description;conditions;requirement;responsibility;key_skills;days
6;52;33936171;Kotlin программист;Санкт-Петербург;0.0;60000.0;BUIDL LLC;2019-10-18T10:49:03+0300;От 1 года до 3 лет;Гибкий график;Проектная работа;"Компания BUIDL - это # современные стек технологии; # интересная предметная область, финансы и блокчейн; # современные архитектурные подходы; # гибкие условия по графику, нет лишнего формализма; свободный подход в общении в коллективе; # разработка технически сложных систем. # разнообразные направления проектов от более близких к “железу” до высоконагруженных и высокодоступных финансовых и информационных сервисов. # крутая и дружная команда, стремительно мчим в будущее , ищем сильных и проактивных игроков, скучно не будет )   Приглашаем программиста-разработчика Kotlin для доработки и переработки Android приложения криптовалютного кошелька-биржи (только Front-End часть, связь с Back по REST API, WSS). Задачи:  Анализ и погружение в существующий проект; Командная доработка приложения (Меняем Kotlin программиста); Подготовка рефакторинга и ребилда приложения; Участие в проектировании    Мы ждем от вас:  Желание решать сложные и нестандартные задачи; Опыт коммерческой мобильной разработки; Понимание работы криптовалют и торговых систем (биржи, фондовые рынки, маркетплейсы)    Условия:   Трудоустройство по ТК РФ   Участие в интересных проектах   Обеспечение всей необходимой техникой   Комфортный офис напротив метро Петроградская   Кухня, завтраки, кофе\чай\сладости\фрукты.   Рост и бонусы   Молодой и дружелюбный коллектив     /Будем благодарны за подробную информацию о себе в отклике/";   Трудоустройство по ТК РФ   Участие в интересных проектах   Обеспечение всей необходимой техникой   Комфортный офис напротив метро Петроградская   Кухня, завтраки, кофе\чай\сладости\фрукты.   Рост и бонусы   Молодой и дружелюбный коллектив     /Будем благодарны за подробную информацию о себе в отклике/;Желание решать сложные и нестандартные задачи. Опыт коммерческой мобильной разработки. Понимание работы криптовалют и торговых систем (биржи, фондовые рынки, маркетплейсы).;Анализ и погружение в существующий проект. Командная доработка приложения (Меняем Kotlin <highlighttext>программиста</highlighttext>). Подготовка рефакторинга и ребилда приложения. Участие в проектировании.;"Android; KOTLIN; Websockets; Git; Atlassian Jira; API; HTML; CSS; Android SDK";0.0
7;70;34034872;Java-программист;Челябинск;60000.0;150000.0;ЧЕЛЯБИНВЕСТБАНК;2019-10-17T10:50:57+0300;От 1 года до 3 лет;Полный день;Полная занятость;"Уважаемые соскатели! Для максимально быстрого рассмотрения вашего резюме к отклику прилагайте образцы исходных текстов.  Обязанности:  Разработка программного обеспечения; Написание микросервисов и сервисов в рамках серверов приложений.  Требования:  Знание Java (Eclipse, IDEA), JDBC, SQL; Опыт написания серверных java-приложений или сервлетов; Опыт работы с какой-либо системой контроля версий (svn, cvs, git); Опыт работы с клиент-серверными базами данных; Понимание работы *NIX-систем; Готовность к сопровождению унаследованного кода, умение тестировать собственнный код; Знания сетевых протоколов и настройки терминального доступа.  Условия:  Сильная команда профессионалов; Программа обучения и наставничества; Социальный пакет:  - Премирование сотрудников Банка (ежемесячное и дополнительное); - ДМС; - Бесплатное медицинское обслуживание сотрудников в медицинской службе Банка; - Организация питания сотрудников по льготным ценам в столовой Банка; - Дополнительные оплачиваемые дни отпуска; - Материальная поддержка сотрудников Банка за счет Банка и профсоюзной организации Банка; - Организация корпоративных мероприятий ко дню Банка и другим праздникам; - Подарки к праздникам сотрудникам Банка и их детям; - Посещение бассейна, спортзала, покупка билетов в театр, кино на льготных условиях; - Частичная компенсация стоимости путевок в детские оздоровительные и спортивные лагеря; - Присвоение почетных званий и памятных знаков с выделением материального поощрения в связи с награждением сотрудников Банка.  5-дневная рабочая неделя; Официальное трудоустройство. ";"  Сильная команда профессионалов; Программа обучения и наставничества; Социальный пакет:  - Премирование сотрудников Банка (ежемесячное и дополнительное); - ДМС; - Бесплатное медицинское обслуживание сотрудников в медицинской службе Банка; - Организация питания сотрудников по льготным ценам в столовой Банка; - Дополнительные оплачиваемые дни отпуска; - Материальная поддержка сотрудников Банка за счет Банка и профсоюзной организации Банка; - Организация корпоративных мероприятий ко дню Банка и другим праздникам; - Подарки к праздникам сотрудникам Банка и их детям; - Посещение бассейна, спортзала, покупка билетов в театр, кино на льготных условиях; - Частичная компенсация стоимости путевок в детские оздоровительные и спортивные лагеря; - Присвоение почетных званий и памятных знаков с выделением материального поощрения в связи с награждением сотрудников Банка.  5-дневная рабочая неделя; Официальное трудоустройство. ";Знание Java (Eclipse, IDEA), JDBC, SQL. Опыт написания серверных java-приложений или сервлетов. Опыт работы с какой-либо системой контроля...;Разработка программного обеспечения. Написание микросервисов и сервисов в рамках серверов приложений.;"Java; SVN; SQL; MS SQL; JDBC; Eclipse; Intellij IDEA; Git";1.0
8;72;34034843;Junior Java developer;Челябинск;60000.0;150000.0;ЧЕЛЯБИНВЕСТБАНК;2019-10-17T10:50:57+0300;От 1 года до 3 лет;Полный день;Полная занятость;"Уважаемые соискатели! Для максимально быстрого рассмотрения вашего резюме к отклику на вакансию прикрепляйте образцы исходных текстов. Обязанности:  Разработка программного обеспечения; Написание микросервисов и сервисов в рамках серверов приложений.  Требования:  Знание Java (Eclipse, IDEA), JDBC, SQL; Опыт написания серверных java-приложений или сервлетов; Опыт работы с какой-либо системой контроля версий (svn, cvs, git); Опыт (возможно начальный) работы с клиент-серверными базами данных; Понимание работы *NIX-систем; Готовность к сопровождению унаследованного кода, умение тестировать собственнный код; Знания сетевых протоколов и настройки терминального доступа.  Условия:  Сильная команда профессионалов; Программа обучения и наставничества; Социальный пакет:  - Премирование сотрудников Банка (ежемесячное и дополнительное); - ДМС; - Бесплатное медицинское обслуживание сотрудников в медицинской службе Банка; - Организация питания сотрудников по льготным ценам в столовой Банка; - Дополнительные оплачиваемые дни отпуска; - Материальная поддержка сотрудников Банка за счет Банка и профсоюзной организации Банка; - Организация корпоративных мероприятий ко дню Банка и другим праздникам; - Подарки к праздникам сотрудникам Банка и их детям; - Посещение бассейна, спортзала, покупка билетов в театр, кино на льготных условиях; - Частичная компенсация стоимости путевок в детские оздоровительные и спортивные лагеря; - Присвоение почетных званий и памятных знаков с выделением материального поощрения в связи с награждением сотрудников Банка.  5-дневная рабочая неделя; Официальное трудоустройство. ";"  Сильная команда профессионалов; Программа обучения и наставничества; Социальный пакет:  - Премирование сотрудников Банка (ежемесячное и дополнительное); - ДМС; - Бесплатное медицинское обслуживание сотрудников в медицинской службе Банка; - Организация питания сотрудников по льготным ценам в столовой Банка; - Дополнительные оплачиваемые дни отпуска; - Материальная поддержка сотрудников Банка за счет Банка и профсоюзной организации Банка; - Организация корпоративных мероприятий ко дню Банка и другим праздникам; - Подарки к праздникам сотрудникам Банка и их детям; - Посещение бассейна, спортзала, покупка билетов в театр, кино на льготных условиях; - Частичная компенсация стоимости путевок в детские оздоровительные и спортивные лагеря; - Присвоение почетных званий и памятных знаков с выделением материального поощрения в связи с награждением сотрудников Банка.  5-дневная рабочая неделя; Официальное трудоустройство. ";Знание Java (Eclipse, IDEA), JDBC, SQL. Опыт написания серверных java-приложений или сервлетов. Опыт работы с какой-либо системой контроля...;Разработка программного обеспечения. Написание микросервисов и сервисов в рамках серверов приложений.;"Java; SVN; SQL; MS SQL; JDBC; Eclipse; Intellij IDEA; Git";1.0
9;15;33804255;Java-программист;Тюмень;100000.0;110000.0;Стабильный Программный Код;2019-09-27T11:04:34+0300;От 3 до 6 лет;Полный день;Полная занятость;Обязанности:  Доработка и сопровождение серверной части системы приема платежей от населения Разработка и сопровождение серверной части мобильного кошелька  Требования:  Знание основных фреймворков SpringFramework, Hibernate, SpringBoot, Vaadin Принципы сетевого взаимодействия, сетевые протоколы HTTP/HTTPS, XMPP, AMQP Основы микросервисов, виртуализация на базе Docker (docker-compose) CI/CD на базе GitLab Английский письменный (обязательно !!!)  Условия:  Полный рабочий день Белая зарплата Работа в офисе в центре города Небольшой коллектив ;  Полный рабочий день Белая зарплата Работа в офисе в центре города Небольшой коллектив ;Знание основных фреймворков SpringFramework, Hibernate, SpringBoot, Vaadin. Принципы сетевого взаимодействия, сетевые протоколы HTTP/HTTPS, XMPP, AMQP. Основы микросервисов, виртуализация на...;Доработка и сопровождение серверной части системы приема платежей от населения. Разработка и сопровождение серверной части мобильного кошелька.;"Java; Spring Framework; Hibernate ORM; Java; Git";21.0
10;88;32375802;Java-разработчик на проект Cбербанк Бизнес Онлайн;Самара;120000.0;0.0;Сбербанк;2019-10-18T09:49:18+0300;От 3 до 6 лет;Полный день;Полная занятость;"Основное наше направление - это автоматизация кассово - инкассатарской (операции с наличными) деятельности для корпоративных клиентов, которое включает в себя на данный момент: · Улучшение единой фронтальной системы (рабочее место для сотрудников в отделениях) в части проведения кассовых операций. Количество пользователей ~ 42 тыс; · Создание/улучшение функциональности в интернет - банке для корпоративных клиентов (СББОЛ) в части кассовых операций (заказ наличных/электронные чеки с выдачей наличных в различных каналах: отделения/доставка/банкоматы) и самоинкассации (взнос наличных в банкоматах). Количество пользователей ~ 1 млн.; · Создание/улучшение функциональности кассовых продуктов во фронтальной системе для банкоматов (СИРИУС). Пример функциональности: биометрия для самоинкассации, выдача наличных по электронным чекам в банкоматах, идентификация по QR коду/NFC. Задачи:  Разработка на Java - языке в рамках проекта; Оптимизация программного кода; Разработка и внедрение программных продуктов компании согласно требованиям технического задания; Проектирование нового функционала продуктов компании;  Наши требования:  Опыт от 2х лет разработки высоко - нагруженных и отказоустойчивых фронтальных систем. Знание основных методологий разработки программного обеспечения, включая гибкие методологии. Умение разбираться в чужом коде, писать чистый и понятный код для других разработчиков. Высшее техническое образование (хорошая методологическая база). Опыт работы с языками программирования и технологиями: Java, SQL, Spring, Hibernate, Gradle, Git, JUnit. Желательно наличие сертификатов Oracle Certified Java Professional Programmer.     Условия работы:  Официальное оформление по ТК РФ. Белая заработная плата (оклад + годовая премия). Профессиональное обучение, семинары, тренинги, конференции. Современный офис, дружная команда. Полный социальный пакет + корпоративный пакет (ДМС, страхование от несчастных случаев, дисконт-программы от компаний партнеров, корпоративные мероприятия, фитнес, тренажерные залы). Адрес: Самара, Московское шоссе 41.   ";;Умение разбираться в чужом коде, писать чистый и понятный код для других <highlighttext>разработчиков</highlighttext>. Высшее техническое образование (хорошая методологическая база). ;Разработка на Java - языке в рамках проекта. Оптимизация программного кода. Разработка и внедрение программных продуктов компании согласно требованиям технического задания. ;"Java; Spring Framework; Hibernate ORM; Java; Git";0.0
