;Index;id;name;city;min_salary;max_salary;company;published_at;experience;schedule;employment;description;conditions;requirement;responsibility;key_skills;days
16;69;33592321;Java разработчик;Омск;0.0;0.0;ЛАНИТ-ТЕХНОЛОГИИ;2019-10-16T12:01:00+0300;От 1 года до 3 лет;Полный день;Полная занятость;"Наша команда уже много лет развивает Государственную информационную систему (ГИС), которая позволяет нашему государству обеспечивать свои потребности в различных товарах, продуктах, услугах. Благодаря этой системе обеспечивается высокая прозрачность и публичность всех процессов государственных закупок, начиная от планирования и до завершения исполнения контрактов. ГИС функционирует в режиме 24x7x365 и обслуживает сотни миллионов запросов в сутки, в системе одновременно работают десятки тысяч пользователей, и постоянно осуществляется взаимодействие с более чем 200 информационными системами в том числе с электронными площадками и региональными системами закупок. Наша архитектура - это независимые функциональные подсистемы, общающиеся друг с другом по внутреннему API. Основные технологии: Java, Hibernate, Spring Core, Spring MVC, EJB, JMS и Oracle RDBMS. Кое-где используется Angular на фронте. Над проектом работают одновременно много команд (более 100 разработчиков совокупно). Мы используем JIRA, Git, автоматизированные сборки, работаем в московском часовом поясе, общаемся в Skype, пишем документацию в Confluence. Чем предстоит заниматься:  Разрабатывать JavaEE приложения, реализовывать новую функциональность, поддерживать и улучшать существующую; Взаимодействовать с аналитиками: анализировать постановки задач на предмет технической реализуемости, предлагать варианты решений; Взаимодействовать с тестировщиками: помогать стабилизировать новый код; Взаимодействовать со специалистами инфраструктуры: помогать в анализе и разрешении инфраструктурных проблем тестовых стендов и продакшена; Диагностировать и решать проблемы в промышленной среде.  Что мы ожидаем от кандидата:  Профессиональный опыт разработки Web приложений с использованием всего или части из перечисленного:  Язык программирования Java, использование Java EE (EJB) будет плюсом; Фреймворки: Spring (Core, Data, MVC), JPA (Hibernate); Серверы приложений: IBM WebShpere, WildFly, Apache Tomcat и др.; СУБД: Oracle, PostgreSQL и др.; Системы сборки: Maven и др.; Управление проектами: Jira и др.;   Хорошее знание жизненного цикла web-приложений, опыт разработки web-сервисов (SOAP/REST); Опыт работы с RDBMS, уверенное знание SQL, умение оптимизировать запросы; Умение обеспечить реализацию задачи в рамках прогнозируемых сроков/трудозатрат и с нужным качеством; Умение понимать код других разработчиков.  Что мы предлагаем:  Участие в интересных проектах в масштабах всей страны; Большие перспективы профессионального и карьерного роста; Хорошо оборудованное рабочее место: мощный компьютер, несколько мониторов; Отличный офис с оборудованной кухней; Социальный пакет. ";;Умение обеспечить реализацию задачи в рамках прогнозируемых сроков/трудозатрат и с нужным качеством. Умение понимать код других <highlighttext>разработчиков</highlighttext>.;Разрабатывать JavaEE приложения, реализовывать новую функциональность, поддерживать и улучшать существующую. Взаимодействовать с аналитиками: анализировать постановки задач на предмет технической реализуемости...;"Java EE; Hibernate ORM; Spring Framework; ORACLE";2.0
17;70;33592315;Ведущий Java разработчик;Омск;0.0;0.0;ЛАНИТ-ТЕХНОЛОГИИ;2019-10-16T12:00:49+0300;От 3 до 6 лет;Полный день;Полная занятость;"Наша команда уже много лет развивает Государственную информационную систему (ГИС), которая позволяет нашему государству обеспечивать свои потребности в различных товарах, продуктах, услугах. Благодаря этой системе обеспечивается высокая прозрачность и публичность всех процессов государственных закупок, начиная от планирования и до завершения исполнения контрактов. ГИС функционирует в режиме 24x7x365 и обслуживает сотни миллионов запросов в сутки, в системе одновременно работают десятки тысяч пользователей, и постоянно осуществляется взаимодействие с более чем 200 информационными системами в том числе с электронными площадками и региональными системами закупок. Наша архитектура - это независимые функциональные подсистемы, общающиеся друг с другом по внутреннему API. Основные технологии: Java, Hibernate, Spring Core, Spring MVC, EJB, JMS и Oracle RDBMS. Кое-где используется Angular на фронте. Над проектом работают одновременно много команд (более 100 разработчиков совокупно). Мы используем JIRA, Git, автоматизированные сборки, работаем в московском часовом поясе, общаемся в Skype, пишем документацию в Confluence. Чем предстоит заниматься:  Разрабатывать JavaEE приложения, реализовывать новую функциональность, поддерживать и улучшать существующую; Взаимодействовать с аналитиками: анализировать постановки задач на предмет технической реализуемости, предлагать варианты решений; Взаимодействовать с тестировщиками: помогать стабилизировать новый код; Взаимодействовать со специалистами инфраструктуры: помогать в анализе и разрешении инфраструктурных проблем тестовых стендов и продакшена; Проектировать подсистемы и программные компоненты; Диагностировать и решать проблемы в промышленной среде.  Что мы ожидаем от кандидата:  Профессиональный опыт разработки Web приложений с использованием всего или части из перечисленного:  Язык программирования Java, использование Java EE (EJB) будет плюсом; Фреймворки: Spring (Core, Data, MVC), JPA (Hibernate); Серверы приложений: IBM WebShpere, WildFly, Apache Tomcat и др.; СУБД: Oracle, PostgreSQL и др.; Системы сборки: Maven и др.; Управление проектами: Jira и др.;   Хорошее знание жизненного цикла web-приложений, опыт разработки web-сервисов (SOAP/REST); Опыт работы с RDBMS, уверенное знание SQL, умение оптимизировать запросы; Умение обеспечить реализацию задачи в рамках прогнозируемых сроков/трудозатрат и с нужным качеством; Общее понимание построения архитектуры информационных систем, желание развиваться в этом направлении; Умение понимать код других разработчиков.  Что мы предлагаем:  Участие в интересных проектах в масштабах всей страны; Большие перспективы профессионального и карьерного роста; Хорошо оборудованное рабочее место: мощный компьютер, несколько мониторов; Отличный офис с оборудованной кухней; Социальный пакет. ";;...и с нужным качеством. Общее понимание построения архитектуры информационных систем, желание развиваться в этом направлении. Умение понимать код других <highlighttext>разработчиков</highlighttext>.;Разрабатывать JavaEE приложения, реализовывать новую функциональность, поддерживать и улучшать существующую. Взаимодействовать с аналитиками: анализировать постановки задач на предмет технической реализуемости...;"Java; Spring Framework; Hibernate ORM; ORACLE";2.0
18;82;33418527;Старший Java-разработчик;Омск;0.0;0.0;АйДи – Технологии управления;2019-10-14T15:27:47+0300;От 3 до 6 лет;Полный день;Полная занятость;"Обязанности:  Разработка новых и развитие уже существующих решений СЭД на собственной платформе (Java 11, Guice, Rest Api):  o Участие в разработке решения; o Разработка и проектирование модели данных; o Проектирование и реализация новых модулей; o Проектирование и реализация интеграционных механизмов с внешними системами;  Исправление ошибок; Подготовка документации по реализованному решению; Распределение и контроль задач.  Обязательные требования:  Знания и наличие опыта разработки на Java (не менее 3 лет); Понимание назначения, ограничений и применение на практике шаблонов проектирования; Опыт работы с реляционными базами данных: построение и анализ производительности SQL запросов, понимание назначения индексов, представлений, функций, процедур и триггеров; Опыт разработки СЭД от 1 года; VCS: GIT; Maven; Нацеленность на достижение результата и ответственность; Умение работать в команде; Знание английского языка на достаточном для чтения технической литературы уровне.  Желательные требования:  Опыт работы с Java Messaging Service; Опыт работы с JNI; Знание C/С++/C#/JS; Опыт работы с JAXWS; Опыт работы с Java RMI.  Условия:  Офис - ст.м. Павелецкая; Оформление по ТК РФ, ДМС; Прозрачная схема профессионального и карьерного роста; Интересные масштабные проекты в компаниях лидерах энергетической отрасли; Премии по итогам года; Зарплата с успешным кандидатом обсуждается в индивидуальном порядке. ";"  Офис - ст.м. Павелецкая; Оформление по ТК РФ, ДМС; Прозрачная схема профессионального и карьерного роста; Интересные масштабные проекты в компаниях лидерах энергетической отрасли; Премии по итогам года; Зарплата с успешным кандидатом обсуждается в индивидуальном порядке. ";Знания и наличие опыта разработки на Java (не менее 3 лет). Понимание назначения, ограничений и применение на практике шаблонов проектирования. ;Разработка новых и развитие уже существующих решений СЭД на собственной платформе (Java 11, Guice, Rest Api): Исправление ошибок. ;"Java; Spring Framework; Hibernate ORM; Java; Git";4.0
19;84;34057145;Старший Java-разработчик;Омск;0.0;0.0;ANCOR FinTech;2019-10-14T06:14:52+0300;От 1 года до 3 лет;Полный день;Полная занятость;"  Чем предстоит заниматься: - Разработка, тестирование и документирование ПО; - Написание понятного исходного кода; - Постоянный контроль ошибок и рефакторинг; - Качественное документирование; - Взаимодействие с внешними подрядчиками; - Прием компетенций по разработке / доработке. От вас потребуется: - Опыт разработки корпоративных приложений Java, Git, Oracle; - Application Server (Jetty, IBM WebSphere Application Server); - MQ (ActiveMQ, IBM WebSphere MQ); - Linux (sh/bash, консольные редакторы). Работа на одном из крупнейших банковских проектов.";;От вас потребуется: - Опыт разработки корпоративных приложений Java, Git, Oracle. - Application Server (Jetty, IBM WebSphere Application Server). - MQ (ActiveMQ, IBM...;Разработка, тестирование и документирование ПО. - Написание понятного исходного кода. - Постоянный контроль ошибок и рефакторинг. - Качественное документирование. - Взаимодействие с внешними подрядчиками. - ;"Java; ORACLE; Spring Framework; IBM WebSphere; sh/bash; Управление проектами";5.0
20;95;33198419;Junior Java Developer (ML);Омск;0.0;0.0;NEOLAB;2019-10-11T07:05:03+0300;От 1 года до 3 лет;Полный день;Полная занятость;"На типичные java - галеры под прикрытием модных слов типа: deep learning, “мы не используем фреймворки”, “мы пишем свой продукт” требуется Java Developer на старте карьеры. Общие требования:  надо понимать алгоритм решения, а не просто уметь применять то, чему научили; опыт программирования. Полгода – год (чтобы потом было понимание насколько у нас круто); java на уровне “банально” (будет пара задачек на входе).  Мы понимаем, что ты, возможно, не умеешь многого из того, что нам надо, но надеемся на умение дисциплинированно работать и читать литературу с гуглом. В зависимости от склонностей и способностей есть два, но сильно пересекающихся направления:  Алгоритмически – аналитическое. Техническое.  Аналитическое направление:  базовые знания мат.статистики и комбинаторики; битовая математика; умение использовать свой мозг; софт скиллы: общение и готовность работать в тесном контакте с коллегами, а также экспертами в профильной области; будет плюсом: знакомство с методами математического моделирования и алгоритмами машинного обучения, а также опыт работы с библиотеками для машинного обучения в Python (scikit-learn, Keras/TensorFlow) и визуализации данных (seaborn, dash).  Техническое направление:  patterns (хотя бы понимание того, что есть вещи, которые принято делать стандартным образом, потому что так всем будет проще); битовая математика; SQL (хотя бы на уровне group by, having); будет плюсом: java streams, concurrent пакет (хоть что-то), понимание (приблизительное) что “под капотом” у базовых вещей типа hashmap, linkedlist и т.д.  Работая в нашей компании (лучшая в мире, лидирует в своей области, динамичнее всех и т.д.), ты сможешь:  писать что-то этакое (а не формочки с менюшечками); работать над собственным «фу-фу-фу легаси» продуктом (который, в отличии от типичного легаси, не просто поддерживается, а активно развивается вот уже лет 10 без переписывания раз в год), где можно приложить себя обо что угодно; быстро проверять теории в бою, получать почти мгновенную обратку от рынка и заказчика; приходить рано, уходить поздно, ходить в шортах (если того хочется); узнать еще одну интерпретацию православного SCRUM, получить возможность еще сильнее прокачаться в интересных тебе направлениях.  Конечно же ты получишь все хорошее, без всего плохого:  обучение: профильное\по заявкам + английский за счет компании; как упомянуто выше: «гибкий график работы» и «демократичную атмосферу без dress code»; в свободном доступе: молоко для кофе, мандарины, канцелярские скрепы, бумажные полотенца и восхитительные точилки для карандашей в переговорках; кресло-стул, 2 монитора, бесперебойник и дизельный генератор у здания; зарплата до фиксированного числа каждого месяца (без исключения), чтобы ничто не могло помешать тебе работать; возможность прокачать спину на турничке, стереть ладошки в кикере; еще где-то есть теннисный стол и PlayStation, ну и относительно чистый пол для отжиманий и плацдарм для отработки троллинга (хотя, кому это интересно); ну и конечно же радости трудового законодательства. ";;;;"Python; Java; Математическая статистика; SQL; Математическое моделирование";8.0
