;Index;id;name;city;min_salary;max_salary;company;published_at;experience;schedule;employment;description;conditions;requirement;responsibility;key_skills;days
0;86;33953070;Ведущий/Старший программист (Java Developer);Москва;197000.0;235000.0;Федеральная нотариальная палата;2019-10-17T13:25:19+0300;От 3 до 6 лет;Полный день;Полная занятость;"О нас: Центр инноваций и информационных технологий при Федеральной нотариальной палате занимается разработкой платформы обработки юридических сведений. У нас большая информационная система, которая состоит из множества подсистем. Интегрирована с банками, реестрами и другими высоконагруженными системами. Вокруг нашего решения строится инфраструктура из интернет порталов, личных кабинетов и автоматизированных рабочих мест. Свой ЦОД и Удостоверяющий центр. Наши задачи: Сейчас мы переходим на новую стадию развития наших продуктов и активно разрабатываем новые сервисы. Новые продукты строим на основе микросервисной архитектуры, существующие модернизируем. Основные требования:  Опыт разработки на Java не менее 3-х лет (Spring, Hibernate, JUnit); Опыт разработки сервисов; SQL и NoSQL базы данных; Коммуникабельность, открытость, дружелюбность.  Будет плюсом: Docker; Kafka, RabbitMQ; Oracle, MySQL; Swagger; Gitlab. Если какие-то технологии незнакомы, но есть желание изучить, то мы готовы обсуждать. Мы будем рады разработчикам разных уровней. Обязанности:  Проектирование и разработка интерфейсов приложений/ключевых технологических и прикладных микросервисов платформы; Разработка интеграционных сервисов; Написание автотестов, исправление багов, участие в ревью кода; Выработка предложений по рефакторингу, участие в создании и развитии внутренних стандартов и практик.  Мы предлагаем:  «Белую» заработную плату, оформление по ТК РФ; Ежегодная индексация заработной платы; ДМС после прохождения испытательного срока; 100% оплата больничного после полугода работы; Материальная помощь к отпуску после года работы; Различные программы обучения и повышения квалификации; Комфортный офис в центре Москвы в 5 минутах от метро.   ";"  «Белую» заработную плату, оформление по ТК РФ; Ежегодная индексация заработной платы; ДМС после прохождения испытательного срока; 100% оплата больничного после полугода работы; Материальная помощь к отпуску после года работы; Различные программы обучения и повышения квалификации; Комфортный офис в центре Москвы в 5 минутах от метро.   ";Опыт разработки на Java не менее 3-х лет (Spring, Hibernate, JUnit). Опыт разработки сервисов. SQL и NoSQL базы данных. ;Проектирование и разработка интерфейсов приложений/ключевых технологических и прикладных микросервисов платформы. Разработка интеграционных сервисов. Написание автотестов, исправление багов, участие в...;"Spring Framework; Hibernate ORM; Java; JUnit; ORACLE; Git; kafka; RabbitMQ; Swagger";1.0
1;25;27592983;Программист Java (Junior/Middle/Senior);Екатеринбург;50000.0;150000.0;Прикладные технологии;2019-10-16T12:09:58+0300;Нет опыта;Полный день;Полная занятость;Ищем Java разработчиков всех уровней (Junior/Middle/Senior) для расширения команды в нескольких проектах нашей компании.   Требования к кандидатам:  Высшее техническое образование (допускаются студенты выпускных курсов). Знание ООП, структур данных и алгоритмов, других фундаментальных понятий из сферы ИТ. Понимание RESTful API. Знание английского языка на уровне, достаточном для ведения рабочей переписки. Резюме на русском и английском языках.    Будет плюсом:  Опыт отладки и оптимизации комплексных приложений. Опыт работы с SQL/NoSQL базами. Опыт работы со Spring, Hibernate и другоми современными framework-ами. Разговорный английский язык.    Обязанности:  Разработка back-end приложений на Java с применением современных framework-ов.    Собеседование только после предоставления резюме.    Условия:  Оклад обсуждается индивидуально. Официальное трудоустройство, социальный пакет по ТК. Гибкий график работы после испытательного срока. Курсы английского языка. Современный офис (настольный футбол, аэрохоккей, теннис и т.д.).    О компании: ООО «Прикладные технологии» уже более 20 лет успешно развивается в сфере разработки программного обеспечения и его тестирования. В настоящее время компания насчитывает более 250 сотрудников, имеет 3 офиса – в Челябинске (головной), Екатеринбурге и Миассе. В деловом портфеле «Прикладных технологий» - заказы отечественных и зарубежных партнеров. Компания готова предложить своим заказчикам не только проверенные стандартные, но и качественные индивидуальные решения задач. Мы стремимся к постоянному расширению набора средств проектирования, разработки и сопровождения программного обеспечения.;  Оклад обсуждается индивидуально. Официальное трудоустройство, социальный пакет по ТК. Гибкий график работы после испытательного срока. Курсы английского языка. Современный офис (настольный футбол, аэрохоккей, теннис и т.д.).    О компании: ООО «Прикладные технологии» уже более 20 лет успешно развивается в сфере разработки программного обеспечения и его тестирования. В настоящее время компания насчитывает более 250 сотрудников, имеет 3 офиса – в Челябинске (головной), Екатеринбурге и Миассе. В деловом портфеле «Прикладных технологий» - заказы отечественных и зарубежных партнеров. Компания готова предложить своим заказчикам не только проверенные стандартные, но и качественные индивидуальные решения задач. Мы стремимся к постоянному расширению набора средств проектирования, разработки и сопровождения программного обеспечения.;Высшее техническое образование (допускаются студенты выпускных курсов). Знание ООП, структур данных и алгоритмов, других фундаментальных понятий из сферы ИТ. ;Разработка back-end приложений на Java с применением современных framework-ов.;"Java; Spring Framework; Hibernate ORM; Java; Git";2.0
2;6;29419604;Программист Java (Junior/Middle/Senior);Челябинск;50000.0;150000.0;Прикладные технологии;2019-10-16T12:09:56+0300;Нет опыта;Полный день;Полная занятость;Ищем Java разработчиков всех уровней (Junior, Middle, Senior) для расширения команды в нескольких проектах нашей компании.   Требования к кандидатам:  Высшее техническое образование (допускаются студенты выпускных курсов). Знание ООП, структур данных и алгоритмов, других фундаментальных понятий из сферы ИТ. Понимание RESTful API. Знание английского языка на уровне, достаточном для ведения рабочей переписки. Резюме на русском и английском языках.    Будет плюсом:  Опыт отладки и оптимизации комплексных приложений. Опыт работы с SQL/NoSQL базами. Опыт работы со Spring, Hibernate и другоми современными framework-ами. Разговорный английский язык.    Обязанности:  Разработка back-end приложений на Java с применением современных framework-ов.    Собеседование только после предоставления резюме. В резюме необходимо указать, на какую вакансию претендуете.   Условия:  Оклад обсуждается индивидуально. Официальное трудоустройство, социальный пакет по ТК. Гибкий график работы после испытательного срока. Курсы английского языка. Современный офис (настольный футбол, аэрохоккей, теннис и т.д.).    О компании: ООО «Прикладные технологии» уже более 20 лет успешно развивается в сфере разработки программного обеспечения и его тестирования. В настоящее время компания насчитывает более 250 сотрудников, имеет 3 офиса – в Челябинске (головной), Екатеринбурге и Миассе. В деловом портфеле «Прикладных технологий» - заказы отечественных и зарубежных партнеров. Компания готова предложить своим заказчикам не только проверенные стандартные, но и качественные индивидуальные решения задач. Мы стремимся к постоянному расширению набора средств проектирования, разработки и сопровождения программного обеспечения.;  Оклад обсуждается индивидуально. Официальное трудоустройство, социальный пакет по ТК. Гибкий график работы после испытательного срока. Курсы английского языка. Современный офис (настольный футбол, аэрохоккей, теннис и т.д.).    О компании: ООО «Прикладные технологии» уже более 20 лет успешно развивается в сфере разработки программного обеспечения и его тестирования. В настоящее время компания насчитывает более 250 сотрудников, имеет 3 офиса – в Челябинске (головной), Екатеринбурге и Миассе. В деловом портфеле «Прикладных технологий» - заказы отечественных и зарубежных партнеров. Компания готова предложить своим заказчикам не только проверенные стандартные, но и качественные индивидуальные решения задач. Мы стремимся к постоянному расширению набора средств проектирования, разработки и сопровождения программного обеспечения.;Высшее техническое образование (допускаются студенты выпускных курсов). Знание ООП, структур данных и алгоритмов, других фундаментальных понятий из сферы ИТ. ;Разработка back-end приложений на Java с применением современных framework-ов.;"Java; Spring Framework; Hibernate ORM; Java; Git";2.0
3;64;32269346;Java-разработчик;Тюмень;30000.0;120000.0;Строительный Двор;2019-10-15T13:38:29+0300;От 1 года до 3 лет;Полный день;Полная занятость;"Строительный Двор - крупнейший поставщик строительных и отделочных материалов с 1993 года!16 городов, 54 розничных магазинов, более 2 000 сотрудников.У нас микросервисная архитектура и agile подход к разработке,нет менеджеров и начальников, у нас есть самоорганизованные команды!Открытость экспериментам и новым инструментам!Мы любим web и у нас всегда есть интересные задачи! Общие требования:  опыт коммерческой разработки (не менее 1 года); опыт командной работы.  Требования к стеку:  Java; Spring Framework (Boot, REST, Data-JPA); PostgreSQL.  Будет плюсом:  знание Docker, Kubernetes; опыт коммерческой разработки с использованием Spring; опыт разработки микросервисов; приверженность к чистому коду и к чистой архитектуре; опыт работы с системами управления версий; умение тестировать код (JUnit, Mockito); желание учиться, развиваться, решать бизнес задачи.  Обязанности:  проектирование, разработка, внедрение и сопровождение проектов компании с использованием технологического стека Java, Spring.  Условия:  Официальная заработная плата, уровень обсуждается на собеседовании; свободный график работы; официальное трудоустройство; современный классный офис со своей столовой; насыщенная корпоративная жизнь; дополнительный официальный день отпуска, за год работы в компании.  Стань частью нашей команды !Мы ждём твоё резюме!";"  Официальная заработная плата, уровень обсуждается на собеседовании; свободный график работы; официальное трудоустройство; современный классный офис со своей столовой; насыщенная корпоративная жизнь; дополнительный официальный день отпуска, за год работы в компании.  Стань частью нашей команды !Мы ждём твоё резюме!";Опыт коммерческой разработки (не менее 1 года). Опыт командной работы. Java. Spring Framework (Boot, REST, Data-JPA). PostgreSQL. ;Проектирование, разработка, внедрение и сопровождение проектов компании с использованием технологического стека Java, Spring.;"Java; Spring Framework; PostgreSQL; Hibernate; Mockito; JUnit; Docker; Kubernetes";3.0
4;68;33554760;Разработчик поисковых систем (Java);Тюмень;30000.0;100000.0;Строительный Двор;2019-10-15T13:38:29+0300;От 1 года до 3 лет;Полный день;Полная занятость;"Строительный Двор - крупнейший поставщик строительных и отделочных материалов с 1993 года!16 городов, 54 розничных магазинов, более 2 000 сотрудников.У нас микросервисная архитектура и agile подход к разработке,нет менеджеров и начальников, у нас есть самоорганизованные команды!Открытость экспериментам и новым инструментам!Мы любим web и у нас всегда есть интересные задачи! Общие требования:  опыт коммерческой разработки (не менее 1 года); опыт командной работы; опыт разработки поисковых систем.  Требования к стеку:  Java; Spring Framework (Boot, REST, Data-JPA); PostgreSQL.  Будет плюсом:  знание Docker, Kubernetes; знание ElasticSearch, Solr ИЛИ Naumen; опыт коммерческой разработки с использованием Spring; опыт разработки микросервисов; приверженность к чистому коду и к чистой архитектуре; опыт работы с системами управления версий; умение тестировать код (JUnit, Mockito); желание учиться, развиваться, решать бизнес задачи.  Обязанности:  проектирование, разработка, внедрение и сопровождение проектов компаниис использованием технологического стека Java, Spring.  Условия:  официальная заработная плата, уровень обсуждается на собеседовании; свободный график работы; официальное трудоустройство; современный классный офис со своей столовой; насыщенная корпоративная жизнь; дополнительный официальный день отпуска за каждый год работы в компании.  Стань частью нашей команды !Мы ждём твоё резюме!";"  официальная заработная плата, уровень обсуждается на собеседовании; свободный график работы; официальное трудоустройство; современный классный офис со своей столовой; насыщенная корпоративная жизнь; дополнительный официальный день отпуска за каждый год работы в компании.  Стань частью нашей команды !Мы ждём твоё резюме!";Опыт коммерческой разработки (не менее 1 года). Опыт командной работы. Опыт разработки поисковых систем. Java. Spring Framework (Boot, REST, Data...;Проектирование, разработка, внедрение и сопровождение проектов компании. С использованием технологического стека Java, Spring.;"Java; Spring Framework; PostgreSQL; Hibernate; Mockito; JUnit; Docker; Kubernetes; Git";3.0
5;24;34128678;Java-программист;Казань;40000.0;90000.0;АйТиБрик;2019-10-17T00:16:32+0300;От 1 года до 3 лет;Полный день;Полная занятость;"Наша студия занимается разработкой веб и мобильных приложений. У нас открыта вакансия Java-программиста. Требования: - Знание языка Java на профессиональном уровне,- Опыт работы с технологиями Spring Framework,- Опыт разработки WEB-приложений от 1 года,- Знание основных шаблонов проектирования и умение их применять,- Знания JavaScript, HTML, CSS,- Знание SQL,- Ответственное отношение к работе.   Желательно: - Опыт работы с JS-фреймворками (Vue.js, jquery и подобные).   Обязанности: - Разработка веб приложений,- Написание и сопровождение кода,- Участие в оценке и планировании задач.   Условия:  Мы веселые и дружелюбные, молодой, динамичный коллектив; Стабильно развивающаяся компания. Хорошие условия для профессионального роста; Интересные проекты и задачи; Хороший офис в центре города. График работы: пятидневка с 9.30 до 18.30; Официальное трудоустройство, отпуска, больничные согласно ТК РФ. ";"  Мы веселые и дружелюбные, молодой, динамичный коллектив; Стабильно развивающаяся компания. Хорошие условия для профессионального роста; Интересные проекты и задачи; Хороший офис в центре города. График работы: пятидневка с 9.30 до 18.30; Официальное трудоустройство, отпуска, больничные согласно ТК РФ. ";Знание языка Java на профессиональном уровне. - Опыт работы с технологиями Spring Framework. - Опыт разработки WEB-приложений от 1 года. - ;Разработка веб приложений. - Написание и сопровождение кода. - Участие в оценке и планировании задач.;"SQL; Java; Java EE; JavaScript; HTML; PostgreSQL";2.0
