29;7;PHP программист;2.0;3.0;Кельник Студиос;2019-12-11T00:56:06+0300;"Мы хотим усилить команду сообразительным PHP-программистом. Чем мы занимаемсяОсновная наша деятельность - разработка сайтов для застройщиков на основе 1С Битрикс.Также осуществляем поддержу и сопровождение сайтов, собранных как нашей компанией, так и сайтов,собранных на других популярных cms и фреймворках, таких как joomla, wordpress, drupal, laravel, yii.   Задачи для тебя  проектирование и сборка новых проектов на базе 1С Битрикс / Битрикс 24 модернизация и поддержка текущих проектов участие в развитии внутренних продуктов    Что мы ожидаем от тебя  опыт работы с PHP 5/7 в связке с БД (MySQL) не менее года понимание ООП и знание нескольких паттернов не понаслышке опыт работы с 1С Битрикс (при отсутствии опыта научим) или другим популярным фреймворком знание основ html, css, js (верстать не требуется) обучаемость, стремление к профессиональному и карьерному росту    Большим плюсом будет, если имеется следующий опыт  участие в создании магазинов, каталогов или других объемных проектов опыт разработки Битрикс на D7 и использование ORM знаком с сервисами (REST, SOAP) наличие сертификатов Битрикс git, composer    Какие знания можем дать тебе  создание компонентов и модулей для 1С Битрикс научим построению процессов разработки объясним принципы gitflow применение composer, phinx использование docker и ci/cd в проектах также познакомим с webpack, vue, pwa, react-native, memcache, redis, sphinx, rabbitMQ, SOAP    Условия трудоустройства  рабочий день с 9:00-11:00 до 18:00-20:00 (пятидневка); работа в офисе недалеко от центра (ст. метро «Новочеркасская» или «Ладожская» c бесплатной развозкой от метро); среда для профессионального роста: опытные наставники, интересные проекты, большая библиотека и возможности роста как в горизонтальном, так и вертикальном направлениях; комфортный офис, большая обеденная зона с холодильником и микроволновкой, кофемашина и множество чаев, игровая с кикером и теннисом; белая заработная плата и зависит только от навыков и результатов сотрудника. оформление по ТК РФ, оплачиваемый больничный, отпуск ";;Опыт работы с PHP 5/7 в связке с БД (MySQL) не менее года. Понимание ООП и знание нескольких паттернов...;Проектирование и сборка новых проектов на базе 1С Битрикс / Битрикс 24. Модернизация и поддержка текущих проектов. Участие в развитии...;"PHP; 1С-Битрикс; Git; Linux; SQL; Ajax; ООП; MySQL";207;0.034482758620689655;PHP;0;0;1;0;1;0;0;0;1;0;0;1;0;0;0;0.0;0.0;0.0;0.0;0.0;0.0;0.0;0.0;0.0;0.0;0.0;0.0;0.0;0.0;0.0;0.0;0.0;0.0;0.0;0.0;1.0
30;31;PHP-разработчик;3.0;3.0;СП.АРМ;2019-12-11T16:44:49+0300;"Обязанности:  Разработка и поддержка сервисов компании: системы управления проектами, тонких клиентов для медицинской системы; Разработка новых web - приложений на PHP; Доработка существующих проектов и возможный рефакторинг реализованных решений.  Требования:  Хорошие знания PHP 7, ООП; Понимание DOCTYPE, знания HTML5, умение писать W3-валидный код, знания CSS; Хорошие знания JS (JQuery/React); Опыт работы с любым из фреймворков (yii2,simfony,cakephp и т.д.); Опыт проектирования архитектуры приложений; Знание основных принципов API (REST API, SOAP, JSON API); Опыт работы с БД ( MySQL-MariaDB, PostgreSQL); Хорошие знания SQL, понимание тонкостей оптимизации запросов; Умение грамотно расставить и использовать индексы; Опыт работы с системой контроля версий GIT; Опыт работы с Ubuntu/Debian/CentOS; Понимание стека TCP/IP или модели OSI; Опыт в администрировании MySQL/Apache/nginx; Уважение и понимание ценностей TDD; Опыт работы в команде и умение выставлять трудоёмкость будущих фич.  Приветствуются дополнительные навыки:  Понимание процессов сборки с использованием Jenkins или подобных; Работа и умение настроить GitLab CI/CD; Опыт работы с ООП в C++ или Java; Понимание ценностей по Agile (очень приветствуются).  Условия:  оформление по ТК РФ; белая заработная плата; современный, комфортабельный офис; ";"  оформление по ТК РФ; белая заработная плата; современный, комфортабельный офис; ";Хорошие знания PHP 7, ООП. Понимание DOCTYPE, знания HTML5, умение писать W3-валидный код, знания CSS. ;Разработка и поддержка сервисов компании: системы управления проектами, тонких клиентов для медицинской системы. Разработка новых web - приложений на PHP. ;"Git; REST; ООП; Yii; SOAP; PHP; HTML; SQL; Linux; JSON API; JavaScript; jQuery; HTML5; Ajax; MySQL; MVC; Работа в команде; TDD; CSS; DevOps; Scrum";231;0.034482758620689655;PHP;0;0;1;0;1;0;0;1;0;0;0;1;0;0;0;0.0;0.0;0.0;0.0;0.0;0.0;0.0;0.0;0.0;0.0;0.0;0.0;0.0;0.0;0.0;0.0;0.0;0.0;0.0;0.0;1.0
31;44;Back-end разработчик PHP крупного высоконагруженного портала недвижимости;2.0;2.0;PDG, интернет-издательство;2019-12-12T11:12:35+0300;Интернет-издательство PDG - крупнейшая онлайн медиа компания в Санкт-Петербурге, развивающая также офис в Москве. Мы создали и управляем проектами, которые уже стали флагманами своих сегментов в России: афиша Петербурга Peterburg2.ru, Интернет-газета Neva.Today, автомобильный журнал 110km.ru, портал рынка недвижимости Restate.ru, социальная сеть путешественников TourOut.ru и другие. В связи с расширением и новыми задачами нам для федеральной мультилистинговой системы специалистов по недвижимости (риэлторов, брокеров, консультантов, застроящиков) Restate.ru (в настоящий момент аудитория ресурса составляет 1.7 млн уникальных человек месяц) необходим junior бекенд программист php.   Обязанности:  Поддержка текущей кодовой базы интеграции с поставщиками данных - интеграторами объявлений недвижимости и автомобилей, агентств, застройщиков, автодилеров, прочих XML систем выгрузки из CRM. Подключения новых поставщиков данных. Написание server-to-server взаимодействий.    Требования:  Знание PHP 5/7. Опыт работы с SQL. Владение git. Умение работать в командной строке Linux. Умение автоматизировать рутинные процессы. Опыт разработки highload систем или работы с большими объёмами данных будет плюсом. Опыт работы с очередями будет плюсом.    Условия:  Работа в динамично развивающейся компании, ставящий интересные глобальные задачи. Своевременная выплата заработной платы. Перспектива профессионального и карьерного роста. Дружный и молодой коллектив.    Порталы PDG сейчас признано являются лидерами своих сегментов в Петербурге. Мы проделали этот большой путь за несколько лет и активно двигаемся вперед. Если Вам не хочется болота, хочется активного развития и перспектив, Вам прямой путь в команду PDG, которая уже сейчас насчитывает более 80 человек.;  Работа в динамично развивающейся компании, ставящий интересные глобальные задачи. Своевременная выплата заработной платы. Перспектива профессионального и карьерного роста. Дружный и молодой коллектив.    Порталы PDG сейчас признано являются лидерами своих сегментов в Петербурге. Мы проделали этот большой путь за несколько лет и активно двигаемся вперед. Если Вам не хочется болота, хочется активного развития и перспектив, Вам прямой путь в команду PDG, которая уже сейчас насчитывает более 80 человек.;Знание PHP 5/7. Опыт работы с SQL. Владение git. Умение работать в командной строке Linux. Умение автоматизировать рутинные процессы. ;Поддержка текущей кодовой базы интеграции с поставщиками данных - интеграторами объявлений недвижимости и автомобилей, агентств, застройщиков, автодилеров, прочих XML систем выгрузки...;"PHP; XML; SQL; Git";244;0.0;PHP;0;0;1;0;1;0;0;0;1;0;0;1;0;0;0;0.0;0.0;0.0;0.0;0.0;0.0;0.0;0.0;0.0;0.0;0.0;0.0;0.0;0.0;0.0;0.0;0.0;0.0;0.0;0.0;1.0
32;53;Программист PHP;1.0;4.0;ЭКБ ТЕСТ;2019-12-10T10:50:38+0300;"Мы предлагаем: Постоянную проектную работу удаленно, корректную постановку технических задач, тестирование, оперативную обратную связь. Основной функционал будет связан с доработкой внутренних web сервисов. Должностные обязанности:  Разработка, поддержка существующих web-проектов и их модернизация. Автоматизация процессов компании.  Требования:  Знание, понимание, опыт работы с кодом в рамках ООП; PSR; Опыт работы с Symfony; Опыт работы с ORM Паттерны проектирования; DOCTRINE; MySQL REST API JS минимально работа с системой контроля версий GIT или SVN;;  Желательно:  Опыт разработки web-проектов; Образование: высшее; Практический опыт работы - не менее 1 года.   ";" Постоянную проектную работу удаленно, корректную постановку технических задач, тестирование, оперативную обратную связь. Основной функционал будет связан с доработкой внутренних web сервисов. Должностные обязанности:  Разработка, поддержка существующих web-проектов и их модернизация. Автоматизация процессов компании.  Требования:  Знание, понимание, опыт работы с кодом в рамках ООП; PSR; Опыт работы с Symfony; Опыт работы с ORM Паттерны проектирования; DOCTRINE; MySQL REST API JS минимально работа с системой контроля версий GIT или SVN;;  Желательно:  Опыт разработки web-проектов; Образование: высшее; Практический опыт работы - не менее 1 года.   ";Знание, понимание, опыт работы с кодом в рамках ООП. PSR. Опыт работы с Symfony. Опыт работы с ORM. Паттерны проектирования. ;Постоянную проектную работу удаленно, корректную постановку технических задач, тестирование, оперативную обратную связь. Основной функционал будет связан с доработкой внутренних web...;;253;0.06896551724137931;PHP;0;0;1;0;1;0;0;0;0;0;1;0;1;0;0;0.0;0.0;0.0;0.0;0.0;0.0;0.0;0.0;0.0;0.0;0.0;0.0;0.0;0.0;0.0;0.0;0.0;0.0;0.0;0.0;1.0
33;57;Ведущий Go/PHP- разработчик;5.0;4.0;Nethouse;2019-12-10T15:54:19+0300;Nethouse - ведущая российская платформа для создания сайтов с более чем миллионом пользователей. Среди наших партнеров Яндекс.Касса, Mail.Ru Group, Альфа-банк. Для еще более активного развития мы хотим усилить команду опытным и талантливым разработчиком. Доверим участие в принятии ключевых решений, разработке архитектуры проекта и увеличении функционала сервиса. Приходите к нам. Создавать сервис, который изменил рынок создания сайтов и не останавливается на достигнутом. Получать бесценный опыт. Делать работу, которой восхищаются десятки тысяч человек. Что нужно:  Опыт коммерческой разработки от 4 лет. Обязательно: Go, PHP. Желательно: gRPC, NodeJS, GraphQL, Docker, RabbitMQ, MySQL, Redis, Memcache, Jest, Zend Framework, Symfony, PHPUnit, Webpack, React Native, Kafka, jMeter, Nginx,Openresty, Sphinx, Elastic Search, Android, Objective-C, Java, Lua, Gomega, Silex, React. Ответственность, умение инициировать процессы и доводить их до результата.    У нас все круто:  Белая заработная плата обсуждается на собеседовании Рост дохода при прокачке hard and soft skills Официальное оформление Гибкий график работы Адекватное руководство, нацеленное на результат, а не шашечки Отсутствие бюрократии и возможность развиваться профессионально: в управленческой и технической ветке Благодарим финансово в самый главный праздник в году У нас классная оборудованная кухня: чай, кофе, молоко, печеньки, фрукты Бизнес-центр прямо у ст. м. Старая Деревня. ;;Опыт коммерческой разработки от 4 лет. Обязательно: Go, PHP. Ответственность, умение инициировать процессы и доводить их до результата.;Для еще более активного развития мы хотим усилить команду опытным и талантливым <highlighttext>разработчиком</highlighttext>. Доверим участие в принятии ключевых решений, разработке...;"PHP; PHP7; TDD; Golang";257;0.06896551724137931;PHP;0;0;1;0;0;1;0;1;0;0;0;1;0;0;0;0.0;0.0;0.0;0.0;0.0;0.0;0.0;0.0;0.0;0.0;0.0;0.0;0.0;0.0;0.0;0.0;0.0;0.0;0.0;0.0;1.0
34;58;Junior/Middle PHP backend developer;2.0;2.0;Новые Решения;2019-12-10T11:41:33+0300;"Мы ищем в свою дружную команду новых backend-разработчиков. Мы бы хотели работать с вами вместе, если вы: - уверенно владеете PHP7 и MySQL, знакомы с Apache и его конфигурированием, - владеете HTML/CSS и базовыми познания в JavaScript, - имеете крепкое общее представление об основном стеке технологий и протоколов, на которых построен и работает Веб. - имеете развитые логику и навыки алгоритмизации, - имеете коммерческой разработки хотя бы от полугода, - можете без особых затруднений читать документацию и гуглить на английском языке, - знаете принципы ООП и умеете использовать их в своём коде, - стремитесь писать надёжный и поддерживаемый код. Необязательно, но будет большим плюсом, если вы: - умеете пользоваться Git, - знакомы с юнит-тестированием и имеете навыки его применения, - имеете опыт работы использования различных современных ORM, CMS или фреймворков из мира PHP, - знаете другие языки программирования - например тот же самый JS на продвинутом для backenda уровне. А в перспективе будет здорово, если вы имели опыт работы с NodeJS и C++/Qt; - знакомы и работали с отличными от MySQL СУБД ( Postgress / Mongo / etc. ), - знакомы и работали с различными актуальными технологиями контейнеризации и развёртывания, масштабирования, кеширования, повышения производительности или отказоустойчивости приложений - например, с Docker, RabbitMQ, Redis или Memcached. Мы создаём и развиваем сайты, игры, мобильные и веб-приложения, устройства и различные системы для комплексной автоматизации и оптимизации бизнеса, при этом как исполняем заказы на разработку, так и имеем собственные коммерческие проекты. В ваши рабочие обязанности в основном будет входить написание бизнес-логики работы и взаимодействия различных систем и приложений, и реализация API для подключения к ней фронтенда. Код нужно будет покрывать тестами и документировать при разработке нового функционала. Условия: Стать частью команды, которая разрабатывает ПО для автоматизации бизнеса; Возможна постоянная работа в перспективе    ";" Стать частью команды, которая разрабатывает ПО для автоматизации бизнеса; Возможна постоянная работа в перспективе    ";уверенно владеете PHP7 и MySQL, знакомы с Apache и его конфигурированием. - владеете HTML/CSS и базовыми познания в JavaScript. - ;Мы создаём и развиваем сайты, игры, мобильные и веб-приложения, устройства и различные системы для комплексной автоматизации и оптимизации бизнеса...;;258;0.06896551724137931;PHP;0;0;1;0;1;0;0;1;0;0;0;1;0;0;0;0.0;0.0;0.0;0.0;0.0;0.0;0.0;0.0;0.0;0.0;0.0;0.0;0.0;0.0;0.0;0.0;0.0;0.0;0.0;0.0;1.0
