;Index;name;min_salary;max_salary;company;published_at;description;requirement;responsibility;key_skills;conditions;id;days;group;city_Екатеринбург;city_Новосибирск;city_Санкт-Петербург;min_experience_0;min_experience_1;min_experience_3;min_experience_6;schedule_Гибкий график;schedule_Полный день;schedule_Сменный график;schedule_Удаленная работа;employment_Полная занятость;employment_Проектная работа;employment_Стажировка;employment_Частичная занятость; MySQL; Git;PHP; JavaScript; PHP; Yii; HTML; ООП; Laravel; Symfony; PostgreSQL; PHP5; CSS; jQuery; Linux; Ajax; AngularJS; MVC; SQL; HTML5;Другие навыки
0;7;Веб-разработчик / веб-программист (PHP/JS);3.0;4.0;НаПоправку.ру;2019-12-12T00:56:12+0300;"НаПоправку — медицинский онлайн-сервис. Мы хотим сделать болезнь меньшим стрессом в жизни человека. Нам важно, что НаПоправку каждый день помогает тысячам людей решать проблемы со здоровьем. Сейчас наш фокус — поиск врача и удобная запись на приём. Впереди — мобильное приложение, электронная медицинская карта и другие онлайн-сервисы, которые сделают медицину проще. Мы ищем в команду талантливого fullstack разработчика, который хочет быстро учиться и участвовать в разработке интересного и полезного продукта. Наш стек  PHP 7.3 MySQL / PostgreSQL / Redis Zend / Laravel ELK Slack Docker Vue / Axios / Webpack / jQuery Jira / Confluence Github PhpStorm  Это вакансия для вас, если вы:   Имеете опыт работы с PHP-фреймворками и MySQL;   Будет преимуществом опыт работы с NoSQL (Redis);   У вас горят глаза и светлая голова;   Хотите не просто писать код и прокачивать свои скилы, а делать классный продукт, который будет помогать людям и даже спасать жизни;   Умеете быстро разбираться в чужом коде и конструктивно с ним работать.   Перед нами стоят различные задачи, как по бекенду, так и по фронтенду. Одно из важных требований к кандидатам - высокий уровень понимания, как устроено взаимодействие между ними - для успешного выполнения наших продуктовых задач. Мы ищем команду специалиста мыслящего в терминах time-to-market, то есть, чтобы новые фичи доходили до прода, как можно быстрее, а не застревали в тестировании. Мы за здоровый баланс между жизнью и работой. Завершить работу вовремя и пойти домой к семье - всегда в приоритете. Тем не менее, мы все работаем на результат - поэтому спринты должны заканчиваться к запланированному сроку. Вы всегда сами можете принять взвешенное решение, стоит ли сегодня задержаться, чтобы успеть в срок. Почему Вам надо идти к нам:   Социально значимый проект, о котором можно с гордостью рассказать даже бабушке;   Много интересных и нестандартных технических задач;   У нас есть чему и у кого поучиться;   Быстрый профессиональный рост - границы роста ограничиваются только вашими способностями;   Молодая, веселая и динамичная команда единомышленников.   Приятные мелочи   Белая зарплата, размер обсуждается с успешным кандидатом;   Оплачиваемое профессиональное развитие – книги, онлайн курсы, семинары и конференции;   Фрукты, снеки, чай и кофе; возможность заказа ужина в офис и корпоративного такси для тех, кто задерживается на работе;   Гибкое начало рабочего дня;   Веселые корпоративы.  ";PHP 7.3. MySQL / PostgreSQL / Redis. Vue / Axios / Webpack / jQuery. Имеете опыт работы с PHP-фреймворками и MySQL. ;;"ООП; PHP; MySQL; Zend Framework; Laravel; JavaScript; Git; Jetbrains Phpstorm";;7;0.0;PHP;0;0;1;0;0;1;0;0;1;0;0;1;0;0;0;1.0;1.0;0.0;1.0;1.0;0.0;0.0;0.0;1.0;0.0;0.0;0.0;0.0;0.0;0.0;0.0;0.0;0.0;0.0;0.0;1.0
1;11;PHP backend senior developer (Symfony/Laravel);6.0;4.0;Alyce;2019-12-11T15:33:23+0300;Кто мы?  Alyce - это американская компания, на рынке с 2016 года, работаем в сфере маркетинга и коммуникаций (корпоративный гифтинг).Наш продукт уже давно и успешно выведен на рынок, он работает и им пользуются более 50 компаний на рынке Северной Америки , из них более 10 клиентов - это компании из рейтинга Fortune500. Например, с нами работают Marketo, Oracle, NetApp, Nutanix, Lenovo.Наша основная ценность - это human approach - человечный подход - и это то, что лежит в основе концепта продукта, а также то, что мы поддерживаем и внутри компании. У нас нет переработок, у нас понятная и работающая структура, нет 150 слоев менеджмента и каких-то организационных overhead-ов или бюрократии (впрочем, беспредела и анархии тоже нет), у нас качественный офис со всеми необходимыми для жизни и комфортной работы условиями, хорошая техника. И - самое важное - это наш продукт - сложный, интересный, технологичный, современный, инновационный, развивающийся и имеющий понятную и позитивную цель. О наших ожиданиях: Мы ищем сильного инженера имеющего видение и широкие знания в современных подходах к разработке распределнных и высоконагруженных приложений. Мы ценим умение предлагать решения, критически оценивать их и находить лучший путь решения для любой задачи. Нам важно, что ты:   Умеешь разрабатывать и поддерживать архитектурные решения   Умеешь разрабатывать тесты, выбирать правильный уровень тестирования для задачи.   Умеешь разбираться в неясных требованиях. Можешь из проблемы сделать задачу.   Отличаешь плохой код от хорошего и предвидишь проблемы в коде.   Можешь доносить свои мысли до бизнеса.   Знаешь инфраструктуру вокруг кода.   Знаешь хорошие и плохие практики к построению API   Стек технологий, с которым мы работаем   Backend: php 7.2+, Laravel/Symfony, Python + Unit tests   Infrastructure: GitLab CI/CD, Google Cloud, Kubernetes, Redis, Docker.   Frontend: Vue.js, Vuex, laravel-mix, Stylus, React, Redux, styled, RxJS, Webpack   Про команду бэкенда Cейчас Backend 8 человек. Каждый разработчик участвует в процессе работы над задачей - обсуждает требования с бизнесом и предлагает решения. Да, у нас есть legacy, и бизнес это понимает. Поэтому мы свободны в выборе новых технологий, а приблизительно 30% нашего спринта занимают технические задачи (рефакторинг, тесты, инструменты и тд) Помимо работы над основными задачами у нас есть возможность прокачаться в тех направлениях которые тебе интересны, у нас есть парень который обожает задачи связанные с performance, а другой горит идеей покрыть наше приложение крутыми тестами. Что мы предлагаем? Мы стремимся к тому, чтобы нашим сотрудникам было интересно и комфортно в рабочем процессе. Помимо материальной составляющей наших взаимоотношений, мы предлагаем:   Гибкий рабочий график.   Медицинскую страховку со стоматологией.   Бонусы, которые привязаны к личным показателям, а также показателям команды и компании в целом.   Мы всячески поддерживаем развитие сотрудника - курсы, участие в конференциях и митапах.   У нас отличный офис в центре Петербурга на пересечении Кирочной и Литейного.   Прозрачная коммуникация, прямое взаимодействие с коллегами - как локальными, так и из Head офиса в Бостоне, отсутствие бюрократии и большого количества разных уровней менеджмента.  ;Знаешь хорошие и плохие практики к построению API. Infrastructure: GitLab CI/CD, Google Cloud, Kubernetes, Redis, Docker.;Умеешь разрабатывать и поддерживать архитектурные решения.;"PHP; Laravel; Software Development; Symfony; Docker; Git; Linux; MySQL; REST; API; Python; PHPUnit";;11;0.034482758620689655;PHP;0;0;1;0;0;1;0;1;0;0;0;1;0;0;0;1.0;1.0;1.0;0.0;0.0;0.0;0.0;0.0;1.0;1.0;0.0;0.0;0.0;0.0;1.0;0.0;0.0;0.0;0.0;0.0;1.0
2;13;PHP Программист YII 2;3.0;4.0;Вимос, торговый дом;2019-12-11T10:33:24+0300;"Обязанности:  Задачи по доработке функционала интернет магазина. Доработка корпоративного портала. Интеграция с различными системами и сервисами по API.    Требования:  Ищем PHP программиста в штат со знанием фреймворка YII 2 Опыт работы с JQuery. Опыт совместной работы, умение быстро понимать чужой код, комментировать свой У нас Git (Bitbucket) JSON API Опыт тестирования и документирования. Желательно опыт работы с Интернет магазинами, а так же Bitrix продуктами, но не обязательно. Работа в офисе не удаленная на постоянной основе. Опыт работы не менее 2 лет.    Условия:  Работа в крупной, динамично развивающейся федеральной сети; Светлый просторный офис Молодая дружная команда профессионалов Оформление в соответствии с Трудовым Кодексом РФ Льготное питание график работы 5/2 (выходные суббота и воскресенье), с 10*00 до 18*00 100% белая заработная плата, выплата 2 раза в месяц ";Ищем PHP <highlighttext>программиста</highlighttext> в штат со знанием фреймворка YII 2. Опыт работы с JQuery. Опыт совместной работы, умение быстро понимать...;Задачи по доработке функционала интернет магазина. Доработка корпоративного портала. Интеграция с различными системами и сервисами по API.;" MySQL; Git;PHP; JavaScript; PHP";"  Работа в крупной, динамично развивающейся федеральной сети; Светлый просторный офис Молодая дружная команда профессионалов Оформление в соответствии с Трудовым Кодексом РФ Льготное питание график работы 5/2 (выходные суббота и воскресенье), с 10*00 до 18*00 100% белая заработная плата, выплата 2 раза в месяц ";13;0.034482758620689655;PHP;0;0;1;0;1;0;0;0;1;0;0;1;0;0;0;1.0;1.0;1.0;1.0;1.0;0.0;0.0;0.0;0.0;0.0;0.0;0.0;0.0;0.0;0.0;0.0;0.0;0.0;0.0;0.0;0.0
3;30;Стажер - программист PHP (Санкт Петербург);3.0;4.0;amazingcat LLC;2019-12-09T15:18:58+0300;amazingcat — компания, занимающаяся разработкой крупных интернет-площадок в сфере e-commerce для зарубежных клиентов. Наш стек технологий:   PHP, Laravel   JavaScript (Vue, Node, Angular 8, Electron)   Magento 2   MySQL / PostgreSQL   Elasticsearch   Shopify   Ruby on Rails   Redis, RabbitMQ   Wordpress   MongoDB   Мы приглашаем начинающих веб-разработчиков пройти оплачиваемую и официальную стажировку на базе нашей компании. В течении всей стажировки мы будем оценивать ваши навыки, прогресс и то как мы срабатываемся, принимая в конце решение о предоставлении оффера на соответствующую должность. Обращаем внимание, что стажировка предполагает минимум семь часов в день, и не подходит для полностью удаленной работы. Мы рассчитываем в первую очередь на ваши знания и не задаём минимальных рамок по опыту коммерческой разработки. Если вы создавали классные проекты для себя или каких-то организаций из интереса или желания помочь — это тоже очень здорово, и тоже считается. Для поступления на стажировку вам необходимы:   Базовые навыки вёрстки   Поверхностные знания JS, ES5+   Опыт разработки на PHP   Опыт работы с любым PHP-фреймворком   Опыт работы с базами данных   Немного о нашей стажировке:   Работа с командой. Мы ещё на этапе стажировки включаем человека в различные внутренние процессы и стараемся наладить взаимодействие с командой, поэтому для нас важно чтобы вы были готовы к этому. На время стажировки вам будет помогать наставник, но мы верим что разнообразие мнений и опыт целой команды может быть гораздо полезнее.   Обучение на реальных кейсах. Стажировка состоит из коммерческих задач, с которыми мы сами когда-то сталкивались и посчитали что они будут полезны. Мы не будем разрабатывать абстрактные лендинги, новостные порталы и системы учёта чего-нибудь, а проработаем реальные ситуации — исследование инцидентов, неструктурированные данные, неоптимальная архитектура, сложные запросы и расширения.   Гибкий график. Мы знаем как сложно бывает совмещать работу с учёбой, поэтому предоставляем по-настоящему гибкий график и возможность часть времени работать из дома. Вам нужно будет только согласовывать в начале недели ваше расписание, чтобы мы были точно уверены в том, что кто-то будет на связи чтобы вам помочь.   Ориентация на результат, а не заполнение времени. Максимальная продолжительность стажировки — три месяца, но обычно ее проходят быстрее. Мы ожидаем что на обучение будет затрачиваться не менее семи часов в день, с присутствием в офисе на протяжении четырёх дней в неделю.   Программа стажировки   Тестовое задание чтобы определить уровень ваших навыков и принять решение о стажировке.   SQL — мы на реальном примере рассмотрим что такое представления, вложенные запросы и джойны, и как их можно совместить в один запрос для агрегации большого массива данных. Расскажем про базовую оптимизацию запросов и архитектуры баз данных.   Laravel — мы рассмотрим процесс создания приложений на этом фреймворке, его основы, работу с Eloquent и QueryBuilder. Расскажем про PSR, описание тестов для Laravel. Помимо самой разработки, мы расскажем о нашем рабочем процессе, как мы организуем работу в Git, сбор ошибок и CI.   Magento 2 — в заключение, мы разберёмся в том, как разрабатываются свои расширения для Magento 2. В качестве экзаменационной работы, мы выступим в роли проджект-менеджера, дадим вам техническое задание на самостоятельную разработку расширения и дальше будем имитировать обычный процесс разработки, с его типичными ситуациями и проблемами. По итогам, мы обсудим, что нам понравилось/не понравилось в вашем рабочем процессе и рассмотрим возможность предоставления оффера.   При отклике, пожалуйста, расскажите нам о себе в сопроводительном письме — какие задачи решали, какие инструменты используете в работе, какое у вас любимое животное и самая интересная ситуация из жизни, связанная с разработкой. Спасибо!;MySQL / PostgreSQL. Ruby on Rails. Мы рассчитываем в первую очередь на ваши знания и не задаём минимальных рамок по опыту...;;"PHP; Linux; Magento; Laravel";;30;0.10344827586206896;PHP;0;0;1;1;0;0;0;1;0;0;0;0;0;1;0;0.0;0.0;1.0;0.0;0.0;0.0;0.0;0.0;1.0;0.0;0.0;0.0;0.0;0.0;1.0;0.0;0.0;0.0;0.0;0.0;1.0
