35;79;PHP Программист-разработчик;5.0;4.0;ГРУППА КИТ;2019-12-09T18:19:11+0300;"Компания КИТ Консалтинг - IT консалтинговая компания, оказывающая услуги по автоматизации деятельности различных предприятий. КИТ Консалтинг является одним из лидеров на рынке облачных технологий, а также виртуализации IT инфраструктур предприятий.   В компании выделены следующие направления деятельности:  внедрение информационных систем (CRM, BI, ERP, СЭД), в т.ч. по модели SaaS (Внедрение ИС с нуля, разработка и поддержка отраслевых решений на платформах Microsoft, 1C, обучение персонала); виртуализация данных и построение виртуальных IT инфраструктур предприятия по модели IaaS (Аутсорсинг ИТ инфраструктуры, в т.ч. миграция данных в облако, построение распределено географических кластеров, виртуальных ЦОДов); стратегический IT консалтинг (Разработка ИТ стратегии, Системы Сбалансированных Показателей, оптимизация IT архитектуры и инфраструктуры предприятия)    Обязанности:  участие в проектах по автоматизации бизнес-процессов; участие в проектах по внедрению и доработке облачных информационных систем (Saas​ и не только); разработка интеграционных решений с использованием API (интеграция Битрикс24/amoCRM/ZohoCrm и др. с веб-сайтами/ Ip-телефонией/ аналитическими сервисами и др.); участие в согласовании технического задания; разработка web-приложений, поддержка и доработка существующих; контроль выполнения задач разработчиками*; контроль соблюдения сроков; взаимодействие с бизнес\системными-аналитиками;  Требования:  умение работать с API различных сервисов/ сайтов /систем; знание PHP/ JavaScript( любого из двух)выше среднего ; опыт работы с CRM, ERP, BI, ECM, BPM, СЭД и другими системами будет преимуществом; структурное мышление, способность разбивать проект на подзадачи, ставить задачи, расставлять приоритеты.  Условия:  испытательный срок 3 месяца; заработная плата обсуждается с успешными кандидатами индивидуально; рабочая неделя 5/2 (09.00-18.00/10.00-19.00); оформление в соответствии с ТК РФ; дружный и молодой коллектив; постоянное обучение сотрудников новым технологиям на рынке облачных услуг; тренинги, дополнительная сертификация.   ";"  испытательный срок 3 месяца; заработная плата обсуждается с успешными кандидатами индивидуально; рабочая неделя 5/2 (09.00-18.00/10.00-19.00); оформление в соответствии с ТК РФ; дружный и молодой коллектив; постоянное обучение сотрудников новым технологиям на рынке облачных услуг; тренинги, дополнительная сертификация.   ";Умение работать с API различных сервисов/ сайтов /систем. Знание PHP/ JavaScript( любого из двух)выше среднего . Опыт работы с CRM...;Участие в согласовании технического задания. Разработка web-приложений, поддержка и доработка существующих. Контроль выполнения задач <highlighttext>разработчиками</highlighttext>*. Контроль соблюдения сроков. ;" MySQL; Git;PHP; ООП; PostgreSQL";279;0.3333333333333333;PHP;1;0;1;0;0;0;1;0;1;0;0;0;1.0;1.0;1.0;1.0;1.0;0.0;0.0;0.0;0.0;0.0;0.0;0.0;0.0;0.0;0.0;0.0;0.0;0.0;0.0;0.0;0.0
36;0;Ведущий PHP-программист;7.0;4.0;ПАБЛИКСПЕЙС;2019-12-10T16:28:03+0300;"PUBLIC SPACE - это международная группа компаний специализирующаяся в сферах digital-marketing и IT-разработок. В состав группы входят как российские, европейские, так и латиноамериканские компании. В связи с плановым расширением мы находимся в поисках Senior PHP-developerа в нашу команду разработчиков.Ваши day-to-day задачи:  работа с использованием фреймворков Yii2 и Zend; работа с БД, а также с механизмами ORM с PostgreSQL, Oracle, MongoDB, Redis; написание unit-тестов (PHPUnit, SimpleTest); работа с Docker, Kubernetes; работа с архитектурой MVC; работа с Git; работа с Jira;  Используемые языки программирования - PHP, Golang;Нам важно, чтобы наш сотрудник работал в максимально комфортных условиях, поэтому мы готовы предложить:  возможность получить опыт/реализовать себя в международной компании с интернациональной командой с разными проектами в Европе, Латинской Америке, РФ; высокий, стабильный уровень заработной платы (обсуждается индивидуально); посещение профильных конференций; гибкий график: возможность расстаться с утренними пробками; комфортные условия работы в одном из наших офисов в Москве (ст. м. Славянский Бульвар); официальное трудоустройство с первого дня по ТК РФ (предусмотрены все соц. выплаты согласно трудовому кодексу); ";;Ваши day-to-day задачи: Работа с использованием фреймворков Yii2 и Zend. Написание unit-тестов (PHPUnit, SimpleTest). ;"MySQL; jQuery; PostgreSQL; ООП; Yii; Git; Docker; RabbitMQ; ActiveMQ; Zend Framework; База данных: Oracle; Atlassian Jira; MVC; MongoDB; Redis; PHP";" MySQL; Git;PHP; ООП; PostgreSQL";300;0.3333333333333333;PHP;1;0;0;1;0;0;1;0;1;0;0;0;1.0;1.0;1.0;1.0;1.0;0.0;0.0;0.0;0.0;0.0;0.0;0.0;0.0;0.0;0.0;0.0;0.0;0.0;0.0;0.0;0.0
37;6;Back-end PHP разработчик;7.0;4.0;Просенс;2019-12-10T13:08:25+0300;"Сегодня мы – абсолютный технологический лидер рынка VR, партнеры крупнейших международных интернет компаний.У нас молодая, крутая команда увлеченных специалистов и в связи с ее расширением и запуском новейшего продукта нам требуется back-end PHP разработчикПриглашаем Вас стать нашим сотрудником и принять активное участие в развитии проекта с историческим потенциалом. Обязанности:  Разработка и поддержка бекенда (PHP/Symphony) платформы видеостриминга Решение оперативных задач  Требования:  Отличные знания PHP (5.6+, ООП, MVC, паттерны) и MySQL (теория, оптимизация запросов). Опыт работы с php-фреймворками (Symphony, Yii2, Laravel, Zend) Опыт разработки веб-приложений и использования HTML/CSS/JS/JQ/Bootstrap Умение работы c cистемами контроля версий; Опыт работы с системами управления задач (redmine, jira, trac).  Дополнительными плюсами будет: Опыт работы с ffmpeg и т.п, понимание принципов кодирования/декодирования и передачи видеопотоковЗнание С/С++ Условия:  Конкурентную зарплату по результатам собеседования. Интересный проект, профессиональный коллектив. Комфортный офис рядом с метро Менделеевская трудоустройство и все социальные гарантии; корпоративный чай/кофе, а также вкусности за счет компании; ";Отличные знания PHP (5.6+, ООП, MVC, паттерны) и MySQL (теория, оптимизация запросов). Опыт работы с php-фреймворками (Symphony...;Разработка и поддержка бекенда (PHP/Symphony) платформы видеостриминга. Решение оперативных задач.;"MySQL; ООП; JavaScript; MVC; Yii; PHP; Atlassian Jira; C++; Веб-программирование";"  Конкурентную зарплату по результатам собеседования. Интересный проект, профессиональный коллектив. Комфортный офис рядом с метро Менделеевская трудоустройство и все социальные гарантии; корпоративный чай/кофе, а также вкусности за счет компании; ";306;0.3333333333333333;PHP;1;0;0;1;0;0;1;0;1;0;0;0;0.0;0.0;0.0;0.0;0.0;0.0;0.0;0.0;0.0;0.0;0.0;0.0;0.0;0.0;0.0;0.0;0.0;0.0;0.0;0.0;1.0
38;13;PHP-разработчик;6.0;4.0;Vilesse;2019-12-10T14:38:45+0300;В международную софтверную компанию в связи с расширением требуется разработчик PHP.   Обязанности:  Разработка больших порталов и сложных систем на PHP. Мы не занимаемся сайтами визитками и простыми интернет-магазинами, у нас вы сможете работать с действительно интересными проектами и многому научиться    Требования:  отличное знание PHP, HTML/ CSS / Javascript хорошее знание MySQL или PostgreSQL понимание ООП, MVC, основных паттернов опыт работы с как минимум одним из популярных фреймворков (например Laravel или Symfony или Yii) опыт с Git базовая работа в Linux Разговорный, или хотя бы письменный английский на хорошем уровне    Не требуется, но может пригодиться при работе на разных проектах:  Опыт с Redis Базовые умения настраивать nginx и Apache2 Composer и работа с пакетами Опыт разработки на других языках (плюсом будет Python, Go или Node.js) опыт работы с высоко-нагруженными проектами и/или проектами с большим количеством данных, умение профилировать и оптимизировать код / запросы / и т.п.    Условия:  100% удаленная работа свободный график демократичные отношения в коллективе и приятная рабочая атмосфера Полностью белое оформление (контракт / NDA) зарплата - по результатами собеседования (сильно выше среднерыночной по отрасли) карьерный рост, ежегодная индексация зарплаты ;Отличное знание PHP, HTML/ CSS / Javascript. Хорошее знание MySQL или PostgreSQL. Понимание ООП, MVC, основных паттернов. Опыт работы с как...;;"PHP5; JavaScript; MySQL; HTML; CSS; jQuery; HTML5; Git; Linux; CMS Wordpress; Apache HTTP Server; Symfony; Laravel; Redis; Nginx; Ajax; AWS";  100% удаленная работа свободный график демократичные отношения в коллективе и приятная рабочая атмосфера Полностью белое оформление (контракт / NDA) зарплата - по результатами собеседования (сильно выше среднерыночной по отрасли) карьерный рост, ежегодная индексация зарплаты ;313;0.3333333333333333;PHP;1;0;0;1;0;0;1;0;1;0;0;0;0.0;0.0;0.0;0.0;0.0;0.0;0.0;0.0;0.0;0.0;0.0;0.0;0.0;0.0;0.0;0.0;0.0;0.0;0.0;0.0;1.0
39;21;PHP разработчик;5.0;3.0;ЛАБИРИНТ;2019-12-09T12:07:35+0300;"Интернет-магазин ЛАБИРИНТ приглашает PHP разработчика. Пожелания:  образование высшее, аналогичный опыт работы от 1 года; отличное владение: PHP, SQL; приветствуется опыт работы с: Yii2; понимание основ: ООП, MVC, защиты информации; опыт работы в команде с использованием SVN или GIT.  Должностные обязанности:  разработка и поддержка API.  Условия:  офис: м. Шаболовская/м. Тульская; график работы: 5х2, с 10.00 до 18.00; оформление по ТК РФ, ежегодная индексация оклада за стаж, обеды в офисе; заработная плата обсуждается на собеседовании, зависит от компетенций кандидата, объема и уровня выполняемых задач.   ";Образование высшее, аналогичный опыт работы от 1 года. Отличное владение: PHP, SQL. Приветствуется опыт работы с: Yii2. ;Разработка и поддержка API.;;"  офис: м. Шаболовская/м. Тульская; график работы: 5х2, с 10.00 до 18.00; оформление по ТК РФ, ежегодная индексация оклада за стаж, обеды в офисе; заработная плата обсуждается на собеседовании, зависит от компетенций кандидата, объема и уровня выполняемых задач.   ";321;0.5;PHP;1;0;1;0;0;0;1;0;1;0;0;0;0.0;0.0;0.0;0.0;0.0;0.0;0.0;0.0;0.0;0.0;0.0;0.0;0.0;0.0;0.0;0.0;0.0;0.0;0.0;0.0;1.0
40;23;Ведущий PHP разработчик;8.0;5.0;АСНА, Сеть аптек;2019-12-10T09:22:38+0300;"Обязанности:  Разработка и поддержка крупного hi-load интернет-магазина; Разработка нового и модификация старого функционала; Документирование разработки; Интеграция с внешними системами (API).  Требования:  Знание PHP версии 7.1 и выше, MYSQL; Опыт написания своих компонентов/модулей; Уверенное владение ООП; Понимание SOLID, паттернов проектирования и архитектурных шаблонов; Опыт работы с системами контроля версий (GIT); Хорошие знания Unix / Linuх; Опыт интеграций со сторонними системами через Rest, SOAP, JSON, AJAX, XML; Дополнительные пожелания: опыт работы с фреймворком Laravel, умение писать Unit и автотесты.  Условия:  Официальная («белая») заработная плата, уровень дохода готовы обсуждать с успешным кандидатом; Трудоустройство согласно ТК РФ с первого дня работы; Компенсация питания; Месторасположение офиса - м. «Ботанический сад» (10 минут пешком). ";Знание PHP версии 7.1 и выше, MYSQL. Опыт написания своих компонентов/модулей. Уверенное владение ООП. Понимание SOLID, паттернов проектирования...;Разработка и поддержка крупного hi-load интернет-магазина. Разработка нового и модификация старого функционала. Документирование разработки. Интеграция с внешними системами...;"PHP; SQL; ООП; MS SQL; JSON API; SOAP; Ajax; REST";"  Официальная («белая») заработная плата, уровень дохода готовы обсуждать с успешным кандидатом; Трудоустройство согласно ТК РФ с первого дня работы; Компенсация питания; Месторасположение офиса - м. «Ботанический сад» (10 минут пешком). ";323;0.3333333333333333;PHP;1;0;1;0;0;0;1;0;1;0;0;0;0.0;0.0;0.0;0.0;0.0;0.0;0.0;0.0;0.0;0.0;0.0;0.0;0.0;0.0;0.0;0.0;0.0;0.0;0.0;0.0;1.0
41;36;Web-разработчик PHP fullstack developer;6.0;4.0;НОУ СОШ НАШИ ПЕНАТЫ;2019-12-12T11:58:17+0300;"На базе частной школы (крупного провайдера заочного обучения) построена образовательная онлайн платформа и система управления обучением (learning management system): IBLS (international blended lerning school) - http://ibls.pro/ Международная школа смешанного обучения *(очная, заочная и семейная формы обучения)..Мы ищем Full Stack Web разработчика со знаниями PHP, умеющего работать в команде и подходить творчески к решению поставленных задач.   Чем придётся заниматься   Написания проекта с нуля под руководством Team Lead   Участие в обсуждении построения будущей архитектуры БД и приложения   Поддержка существующей системы   Стек технологий   PHP 7.x   MySQL   Git / Bitbucket   Yii2   Vue   Bootstrap 4   Требования   Знание языка PHP   Опыт работы с MySQL;   Yii2 ( либо знание другого фреймворка и готовность перейти на Yii2 )   Опыт работы с ORM   Понимание принципов ООП‚ SOLID   Знание принципов Front End разработки   Знание верстки, Bootstrap 4   Уметь соблюсти срок или вовремя сигнализировать о проблемах     Приветствуются   Знание front End фреймворков желательно Vue.js   Опыт написания REST API   Наличие github аккаунта с примерами Вашего кода (или возможность его предоставить).   Условия   Официальное трудоустройство по ТК РФ   Возможность гибкого графика работы   Интересный, востребованный на рынке, динамично развивающийся уже несколько лет проект - есть возможность себя проявить   Белая зарплата   Комфортабельный офис в современном дизайнерском бизнес-центре   Свободная атмосфера в офисе, дружелюбный коллектив и адекватное руководство   Чай, кофе, сладости  ";Знание языка PHP. Опыт работы с MySQL. Yii2 ( либо знание другого фреймворка и готовность перейти на Yii2 ). ;Написания проекта с нуля под руководством Team Lead. Участие в обсуждении построения будущей архитектуры БД и приложения. Поддержка существующей системы.;"JavaScript; Bootstrap; MySQL; Yii; PHP; REST";" MySQL; Git;PHP; ООП; PostgreSQL";336;0.0;PHP;1;0;0;1;0;0;1;0;1;0;0;0;1.0;1.0;1.0;1.0;1.0;0.0;0.0;0.0;0.0;0.0;0.0;0.0;0.0;0.0;0.0;0.0;0.0;0.0;0.0;0.0;0.0
