;Index;name;min_salary;max_salary;company;published_at;description;requirement;responsibility;key_skills;conditions;id;days;group;city_Екатеринбург;city_Новосибирск;city_Санкт-Петербург;min_experience_0;min_experience_1;min_experience_3;min_experience_6;schedule_Гибкий график;schedule_Полный день;schedule_Сменный график;schedule_Удаленная работа;employment_Полная занятость;employment_Проектная работа;employment_Стажировка;employment_Частичная занятость;Python; Django Framework; Git; PostgreSQL; SQL; Linux; JavaScript; MySQL; Python; ООП;CSS; HTML; Nginx; Redis; Java; Flask; Unit Testing;Высоконагруженные распределённые системы дистрибуции и кэширования данных. Кластерные системы обработки массивов данных. Web-сервисы (backend). Системы защиты веб-ресурсов от...;Разработка инструментов для оптимизации создания рекламных материалов в рекламных системах.;Python пакет/API разрабатывается на основе уже существующего питоновского OneTick API. Помощь <highlighttext>разработчикам</highlighttext> и клиентам пользоваться пакетом и улучшать его...;Другие навыки
0;5;Python разработчик;3.0;5.0;Digital Security;2019-12-10T17:15:56+0300;"Наша команда веб-разработки ищет Python разработчика для реализации крутого веб-проекта. Мы занимаемся производством продуктов для собственной команды аудиторов информационной безопасности. Именно ты нам нужен, если: ты любишь интересные задачи, не боишься креатива, умеешь работать в команде, заинтересован в быстром росте. В нашей команде ты получишь: возможность прокачаться в сфере информационной безопасности, оформление в соответствии с ТК РФ, гибкий график присутствия в офисе, ДМС со стоматологией, уютный офис с бесплатными фруктами, PS и грушей, в самом центре СПб.   Твоя основная задача: разработка back-end нашего нового продукта   Технологии, с которыми ты должен быть знаком: Python - требуемый опыт работы с реальными проектами от 2-х лет; знание основных шаблонов проектирования и особенностей их реализации; опыт написания модульных тестов.   Желательно: REST API и/или gRPC: знакомство/работа; SQLAlchemy: опыт работы с этим или другими аналогичными ORM; PostgreSQL: необходим, хотя бы, минимальный опыт работы с этой или любой другой реляционной СУБД; Linux: хотя бы на уровне пользователя; Docker: на уровне представления; Kubernetes: на уровне представления; баг-трекеры: опыт работы; CD/CI системы: опыт работы; git: опыт работы; графовые БД (Neo4J): будет большим плюсом.";Технологии, с которыми ты должен быть знаком: Python - требуемый опыт работы с реальными проектами от 2-х лет. ;Docker: на уровне представления. Kubernetes: на уровне представления.;Python;;5;0.06896551724137931;Питон;0;0;1;0;1;0;0;1;0;0;0;1;0;0;0;1.0;0.0;0.0;0.0;0.0;0.0;0.0;0.0;0.0;0.0;0.0;0.0;0.0;0.0;0.0;0.0;0.0;0.0;0.0;0.0;0.0
1;39;Junior Python Developer (Django);4.0;5.0;Акрибия;2019-12-12T13:09:53+0300;"Группа компаний в сфере информационной безопасности Акрибия приглашает в штат Back-end Python-разработчика (Django). У нас очень много интересных профильных задач, дружеская, почти семейная атмосфера и отличные условия труда! Обязанности:  Проектирование и разработка нестандартных распределённых веб-приложений; Проектирование и реализация REST API; Построение связей между различными сервисами; Взаимодействие с тестовым отделом.  Требования к кандидату:  Опыт работы с Python/Django от 1 года; Опыт работы с REST API; Опыт работы в операционных системах семейства Linux; Знание основных сетевых протоколов.  Будет плюсом:  Знание DRF; Знание каких-либо других языков программирования, в т.ч. ASP || JSP || NodeJS; Опыт fullstack разработки; Знания в области информационной безопасности, в т.ч. безопасности разработки приложений.  Мы предлагаем:  Гибкий график рабочего дня - возможность посещать офис в удобное время; Современный офис в центре города; Молодой, дружный коллектив, комфортная рабочая атмосфера, лояльное руководство; Профессиональная поддержка и обучение на первом этапе работы; Для кандидатов из других городов - аренда жилья на первый месяц работы; ДМС после испытательного срока, компенсация затрат на обучение, повышение квалификации и другие программы стимулирования для сотрудников; Официальное трудоустройство по ТК РФ с первого рабочего дня; Хороший кофе, чай, сладости и фрукты в офисе. ";Опыт работы с Python/Django от 1 года. Опыт работы с REST API. Опыт работы в операционных системах семейства Linux. ;Проектирование и разработка нестандартных распределённых веб-приложений. Проектирование и реализация REST API. Построение связей между различными сервисами. Взаимодействие с тестовым...;"Python; Django Framework";"  Гибкий график рабочего дня - возможность посещать офис в удобное время; Современный офис в центре города; Молодой, дружный коллектив, комфортная рабочая атмосфера, лояльное руководство; Профессиональная поддержка и обучение на первом этапе работы; Для кандидатов из других городов - аренда жилья на первый месяц работы; ДМС после испытательного срока, компенсация затрат на обучение, повышение квалификации и другие программы стимулирования для сотрудников; Официальное трудоустройство по ТК РФ с первого рабочего дня; Хороший кофе, чай, сладости и фрукты в офисе. ";39;0.0;Питон;0;0;1;0;1;0;0;1;0;0;0;1;0;0;0;1.0;1.0;0.0;0.0;0.0;0.0;0.0;0.0;0.0;0.0;0.0;0.0;0.0;0.0;0.0;0.0;0.0;0.0;0.0;0.0;0.0
2;57;Junior Python разработчик;4.0;5.0;404 Group;2019-12-11T14:53:47+0300;"404 Group - международная IT компания (Fintech) ищет классного начинающего Python разработчика, которому уже есть что рассказать о своих успехах в разработке. Мы делаем продукт, который включает в себя свою финансовую платформу, содержит аналитическую систему. Система перерабатывает большой объем данных и предоставляет продуктовую и web аналитику в режиме реального времени.Проекту уже более четырех лет, он функционирует в условиях постоянных интенсивных нагрузок, спектр возникающих задач широк и чертовски сложен. Зачем тебе к нам:  Много интересных задач и минимум бюрократии; Сможешь прокачать себя как в коде, так и в архитектуре приложений; Работа с высоконагруженной системой, а не просто с сайтами и скриптами; Сможешь подходить к каждой задаче индивидуально и видеть результаты своих трудов; Мы всегда готовы обсудить новые идеи и приветствуем исследовательский подход.  Что мы хотим видеть в нашем будущем коллеге:  Опыт разработки от 1 года на Python 3 (3.5 +); Опыт работы с фреймворками Flask, Django; Опыт написания тестов: unittest, pytest; Опыт работы с SQL; Понимание принципов ООП и умение применять их на практике; Желание осваивать новое через решение сложных задач;  Будет плюсом:  знакомство с языками Golang, JS; работа с HightLoad проектами; работа с аналитическими библиотеками: pandas, numpy; работа с selenium; знакомство с ETL, лямбда-архитектурой; работа с Apache Airflow, Vertica.  Что мы предлагаем:  Дружескую атмосферу и опытного наставника;  Официальное оформление по ТК РФ и белую заработную плату;   Гибкое начало рабочего дня;   28 дней отпуска + оплачиваемые дополнительные выходные;   Доплату больничного до оклада (любое количество дней);   ДМС с возможностью прикрепить родственников к нашей программе;   Курсы английского языка в офисе;   Йогу, спорт зал в офисе и частичную компенсацию занятий спортом;   Обучение за счет компании: финансирование курсов/семинаров/тренингов;   Современный комфортабельный офис и оборудование;   Корпоративные завтраки, чай-кофе-сладости, кикер и playstation, шахматы и пуфики.  ";Сможешь подходить к каждой задаче индивидуально и видеть результаты своих трудов. Что мы хотим видеть в нашем будущем коллеге: Опыт...;Работа с высоконагруженной системой, а не просто с сайтами и скриптами. Работа с HightLoad проектами. Работа с аналитическими библиотеками: pandas...;"Python; SQL; Git; Django Framework; Flask; Unit Testing; ООП";;57;0.034482758620689655;Питон;0;0;1;0;1;0;0;0;1;0;0;1;0;0;0;1.0;1.0;1.0;0.0;1.0;0.0;0.0;0.0;0.0;1.0;0.0;0.0;0.0;0.0;0.0;1.0;1.0;0.0;0.0;0.0;0.0
3;93;Программист Python/ActionScript;4.0;5.0;Wargaming;2019-12-12T11:29:16+0300;"Компания Wargaming Saint Petersburg (Lesta Studio) приглашает Программиста (Python, AS3) на проект World of Warships. Обязанности:  Разработка функциональности интерфейсов игры World of Warships. Разработка функциональности фреймворков. Поддержка, развитие, рефакторинг существующих решений.    Требования:   Отличное знание ActionScript и/или Python;  Отличное владение ООП; Высокий уровень профессиональной эрудиции; Технический английский (на уровне чтения документации).  Приветствуется:  Знание ActionSctipt3 и/или опыт работы с Flash IDE; Знание С++; Опыт разработки клиент – серверных приложений; Опыт работы со ScaleForm; Большой игровой опыт, желание заниматься разработкой игр.  Мы предлагаем:  Интересную сложную работу над уникальными игровыми проектами мирового уровня в составе успешной, профессиональной и слаженной команды. Разнообразные интересные задачи, свободу в работе над ними. Возможность приобрести бесценный опыт, работая плечом к плечу с ведущими специалистами отрасли. Пятидневную рабочую неделю, время работы с 9:30 до 18:30. Комфортные условия труда в современном просторном офисе в шаговой доступности от ст. м. Ладожская. ДМС, корпоративный спорт. Корпоративное обучение по специальности, изучение английского языка. Реализацию ваших лучших качеств!   ";Отличное знание ActionScript и/или Python. Отличное владение ООП. Высокий уровень профессиональной эрудиции. Технический английский (на уровне чтения документации). ;Разработка функциональности интерфейсов игры World of Warships. Разработка функциональности фреймворков. Поддержка, развитие, рефакторинг существующих решений.;"Python; Django Framework; Git; PostgreSQL; SQL";  Интересную сложную работу над уникальными игровыми проектами мирового уровня в составе успешной, профессиональной и слаженной команды. Разнообразные интересные задачи, свободу в работе над ними. Возможность приобрести бесценный опыт, работая плечом к плечу с ведущими специалистами отрасли. Пятидневную рабочую неделю, время работы с 9:30 до 18:30. Комфортные условия труда в современном просторном офисе в шаговой доступности от ст. м. Ладожская. ДМС, корпоративный спорт. Корпоративное обучение по специальности, изучение английского языка. Реализацию ваших лучших качеств!   ;93;0.0;Питон;0;0;1;0;1;0;0;0;1;0;0;1;0;0;0;1.0;1.0;1.0;1.0;1.0;0.0;0.0;0.0;0.0;0.0;0.0;0.0;0.0;0.0;0.0;0.0;0.0;0.0;0.0;0.0;0.0
4;95;Python разработчик (Django);2.0;3.0;Интернет Лид;2019-12-10T23:09:02+0300;"  Описание Компания-разработчик программного продукта для сферы образования «Интернет Лид» приглашает на работу активных людей для долгосрочного сотрудничества, материального и профессионального роста на позицию python full-stack разработчика в удаленную команду. О компании С 2011 года ООО “Интернет Лид” занимается разработкой и внедрением веб-сервисов для системы образования. Команда имеет опыт более 9 лет в проектировании систем и работе с образовательными организациями и пользователями образовательных услуг. О продукте Информационная система «Мапа.рус» - веб-сервис и мобильное приложение для дошкольных организаций: аналитические, коммуникационные и CRM-инструменты для садов и центров развития (сотрудников и родителей). Требования к кандидату:  Опыт работы с Python/Django от 1 года;    Будет плюсом:  Опыт работы с REST API; Знание Linux OS and Postgres DB; Опыт работа с Version Control Systems (Git); Хорошее знание HTML, CSS, JavaScript. Знакомство с PHP, MySQL, Wordpress. Опыт работы в команде; Хороший письменный и разговорный английский; Опыт в тестировании кода.    Наши условия работы:  Удаленная работа, частичная занятость с оговариваемым графиком или full-time ; Разносторонние интересные проекты; Развитие растущего многопользовательского сервиса.     ";Опыт работы с Python/Django от 1 года. Будет плюсом: Опыт работы с REST API. Знание Linux OS and Postgres...;О продукте. Информационная система «Мапа.рус» - веб-сервис и мобильное приложение для дошкольных организаций: аналитические, коммуникационные и CRM-инструменты для садов...;"CSS; Git; Linux; PostgreSQL; JavaScript; MySQL; Django Framework; HTML; Python";;95;0.034482758620689655;Питон;0;0;1;0;1;0;0;0;0;0;1;1;0;0;0;0.0;1.0;1.0;1.0;0.0;1.0;1.0;1.0;1.0;0.0;1.0;1.0;0.0;0.0;0.0;0.0;0.0;0.0;0.0;0.0;0.0
